label,comment,author,subreddit,score,ups,downs,date,created_utc,parent_comment,vader_comment,vader_pcomment
1,that makes us smart,DicNavis,hockey,6,-1,-1,2016-10-01,2016-10-25 21:39:51,yea another reason to hate the rangers i pay more taxes than they do,"{'neg': 0.0, 'neu': 0.501, 'pos': 0.499, 'compound': 0.4574}","{'neg': 0.298, 'neu': 0.702, 'pos': 0.0, 'compound': -0.6249}"
1,will not be able to concentrate on killing her with her cleavage in my face,Vexyfi,FFXV,7,-1,-1,2016-11-01,2016-11-04 22:14:27,cindy no one will see it coming,"{'neg': 0.253, 'neu': 0.747, 'pos': 0.0, 'compound': -0.6597}","{'neg': 0.268, 'neu': 0.732, 'pos': 0.0, 'compound': -0.296}"
1,do they have a military in canada,BeenCarl,todayilearned,1,-1,-1,2016-11-01,2016-11-04 22:42:39,do they have one of these in canada,"{'neg': 0.0, 'neu': 1.0, 'pos': 0.0, 'compound': 0.0}","{'neg': 0.0, 'neu': 1.0, 'pos': 0.0, 'compound': 0.0}"
1,usa probably,auntiepink,AskReddit,2,-1,-1,2016-11-01,2016-11-04 23:26:19,in what country does american accent speaking the local language well earn you the most points,"{'neg': 0.0, 'neu': 1.0, 'pos': 0.0, 'compound': 0.0}","{'neg': 0.0, 'neu': 0.877, 'pos': 0.123, 'compound': 0.2732}"
1,but it was clearly only dismissed because of death threats even though literally no one fucking knows her name,areraswen,The_Donald,6,-1,-1,2016-11-01,2016-11-04 23:54:51,trump rape lawsuit dismissed,"{'neg': 0.39, 'neu': 0.493, 'pos': 0.117, 'compound': -0.8519}","{'neg': 0.767, 'neu': 0.233, 'pos': 0.0, 'compound': -0.765}"
1,oh yea there is no criticism towards the bs,Snakers716,BigBrother,1,-1,-1,2016-11-01,2016-11-05 00:02:18,i like 34 of the bsers too lol i just dislike this subs intolerance toward any type of bs criticism,"{'neg': 0.0, 'neu': 0.744, 'pos': 0.256, 'compound': 0.3412}","{'neg': 0.205, 'neu': 0.597, 'pos': 0.198, 'compound': -0.0516}"
1,do not worry you will inevitably topdeck nourish next turn anyways,DebugLifeChoseMe,hearthstone,1,-1,-1,2016-11-01,2016-11-05 00:09:44,then not have a hand,"{'neg': 0.0, 'neu': 0.769, 'pos': 0.231, 'compound': 0.3412}","{'neg': 0.396, 'neu': 0.604, 'pos': 0.0, 'compound': -0.3875}"
1,stop comparing everything to watergate,SeaSquirrel,politics,1,-1,-1,2016-11-01,2016-11-05 01:09:46,ok now we are getting into some watergate level shit,"{'neg': 0.355, 'neu': 0.645, 'pos': 0.0, 'compound': -0.296}","{'neg': 0.31, 'neu': 0.69, 'pos': 0.0, 'compound': -0.5574}"
1,it could confuse your muscles and make muscle grow in places where you did not actually work out,dinosauralienspirits,Fitness,1,-1,-1,2016-11-01,2016-11-05 01:13:22,is there such thing as too much creatine,"{'neg': 0.106, 'neu': 0.894, 'pos': 0.0, 'compound': -0.2263}","{'neg': 0.0, 'neu': 0.854, 'pos': 0.146, 'compound': 0.0516}"
1,i think his username was fireforeffect without the for,Player72,WorldofTanks,1,-1,-1,2016-11-01,2016-11-05 01:26:36,well normally the phrase is fire for effect but in this case i rather think it is fire without effect,"{'neg': 0.0, 'neu': 1.0, 'pos': 0.0, 'compound': 0.0}","{'neg': 0.215, 'neu': 0.716, 'pos': 0.069, 'compound': -0.5023}"
1,well it is fine for me so you might need to upgrade your service,Fancyscum,FIFA,1,-1,-1,2016-11-01,2016-11-05 02:14:59,delay lag is absurd this week started playing the weekend league and after 2 matches i am off again the delay lag got even worse this week and considering it was normal until yesterday i think the high number of people playing the weekend league is destroying the ea servers every single action i do takes an eternity cannot mark properly passes got even worse and not only me can notice the same thing happening to my opponent what an awful experience once again,"{'neg': 0.0, 'neu': 0.738, 'pos': 0.262, 'compound': 0.4404}","{'neg': 0.224, 'neu': 0.727, 'pos': 0.049, 'compound': -0.9558}"
1,well it has to be healthy because it sure is not delicious,egbertincognito,fatlogic,3,-1,-1,2016-11-01,2016-11-05 02:30:44,in a plastic container using a plastic fork a bowl of carbs with raisins,"{'neg': 0.175, 'neu': 0.409, 'pos': 0.415, 'compound': 0.477}","{'neg': 0.0, 'neu': 1.0, 'pos': 0.0, 'compound': 0.0}"
1,you know in some countries women with two sets of breasts are revered,egbertincognito,fatlogic,26,-1,-1,2016-11-01,2016-11-20 00:13:36,thin priviledge is only having one set of breasts who knew,"{'neg': 0.0, 'neu': 0.784, 'pos': 0.216, 'compound': 0.5106}","{'neg': 0.0, 'neu': 1.0, 'pos': 0.0, 'compound': 0.0}"
1,probably have to add some boiled honey to get the full effect,egbertincognito,fatlogic,19,-1,-1,2016-11-01,2016-11-30 05:45:52,whoa whoa whoa stop the presses five cups of green tea will burn 70 extra calories what is the point of that i mean i like tea but i would not add that into my calories burned column,"{'neg': 0.0, 'neu': 1.0, 'pos': 0.0, 'compound': 0.0}","{'neg': 0.041, 'neu': 0.897, 'pos': 0.062, 'compound': 0.2028}"
1,i do not know a bigger acorn,sdb2754,funny,4,-1,-1,2016-11-01,2016-11-05 02:51:04,it is okay took me a long while to catch it so here is a clue what does an acorn turn into,"{'neg': 0.416, 'neu': 0.584, 'pos': 0.0, 'compound': -0.2808}","{'neg': 0.0, 'neu': 0.909, 'pos': 0.091, 'compound': 0.2263}"
1,yeah but crazy does not really mean anything you are just trying to silence her,stokleplinger,h3h3productions,13,-1,-1,2016-11-01,2016-11-05 02:54:24,she crazy,"{'neg': 0.197, 'neu': 0.701, 'pos': 0.102, 'compound': -0.3612}","{'neg': 0.706, 'neu': 0.294, 'pos': 0.0, 'compound': -0.34}"
1,tim tebow,AlcoholicWombat,baseball,9,-1,-1,2016-11-01,2016-11-05 03:47:45,greats who almost went undiscovered i started thinking about this after reading about how walter johnson was discovered playing in the idaho state league by a senators scout who do you think are some baseball greats who could have gone undiscovered,"{'neg': 0.0, 'neu': 1.0, 'pos': 0.0, 'compound': 0.0}","{'neg': 0.0, 'neu': 0.948, 'pos': 0.052, 'compound': 0.2869}"
1,just drive it in reverse for a mile,Aperson3334,mildyinfuriating,3,-1,-1,2016-11-01,2016-11-05 05:48:50,this odometer is 1 mile past 111111,"{'neg': 0.0, 'neu': 1.0, 'pos': 0.0, 'compound': 0.0}","{'neg': 0.0, 'neu': 1.0, 'pos': 0.0, 'compound': 0.0}"
1,because _true_ master race ascendants play games on linux,romXXII,SquaredCircle,22,-1,-1,2016-11-01,2016-11-05 06:09:09,alright first off i was obviously kidding and second how am i a cuck for liking a gaming system,"{'neg': 0.0, 'neu': 0.574, 'pos': 0.426, 'compound': 0.6369}","{'neg': 0.0, 'neu': 0.724, 'pos': 0.276, 'compound': 0.6249}"
1,because this has never been posted before,StachTBO,gaming,19,-1,-1,2016-11-01,2016-11-05 06:51:53,the logical next step in the gta series,"{'neg': 0.0, 'neu': 1.0, 'pos': 0.0, 'compound': 0.0}","{'neg': 0.0, 'neu': 1.0, 'pos': 0.0, 'compound': 0.0}"
1,malinis pagkakatrabaho dito kay mayor walang kaduda dudang nanlaban at hindi pinatay lang basta basta,jQiNoBi,Philippines,13,-1,-1,2016-11-01,2016-11-05 09:12:27,cctv footage of albuera mayor's death missing,"{'neg': 0.0, 'neu': 1.0, 'pos': 0.0, 'compound': 0.0}","{'neg': 0.55, 'neu': 0.45, 'pos': 0.0, 'compound': -0.7269}"
1,you see he might some slight errors in the worlds finals game as a 17 year old guy in his rookie split must mean he is bad,danymsk,leagueoflegends,2,-1,-1,2016-11-01,2016-11-05 10:54:53,,"{'neg': 0.189, 'neu': 0.811, 'pos': 0.0, 'compound': -0.6815}","{'neg': 0.0, 'neu': 1.0, 'pos': 0.0, 'compound': 0.0}"
1,are not they,loukitch,AskReddit,6,-1,-1,2016-11-01,2016-11-05 11:14:50,you are basically saying that americans are fucking stupid,"{'neg': 0.0, 'neu': 1.0, 'pos': 0.0, 'compound': 0.0}","{'neg': 0.345, 'neu': 0.655, 'pos': 0.0, 'compound': -0.5709}"
1,you forgot,Domri_Rade,newjersey,3,-1,-1,2016-11-01,2016-11-05 14:00:44,citation needed,"{'neg': 0.0, 'neu': 1.0, 'pos': 0.0, 'compound': 0.0}","{'neg': 0.0, 'neu': 1.0, 'pos': 0.0, 'compound': 0.0}"
1,i think you misspelled yoga,Trumpthulhu-Fhtagn,The_Donald,1,-1,-1,2016-11-01,2016-11-05 15:51:01,confirmed by state dept crooked hillary sent classified information to chelsea then covered it up by deleting the email that showed it,"{'neg': 0.0, 'neu': 1.0, 'pos': 0.0, 'compound': 0.0}","{'neg': 0.0, 'neu': 1.0, 'pos': 0.0, 'compound': 0.0}"
1,yeah because his native american family will do so much better with trump as president,Forestman88,politics,12,-1,-1,2016-11-01,2016-11-05 15:52:08,democratic presidential elector says he will not vote for hillary clinton,"{'neg': 0.0, 'neu': 0.707, 'pos': 0.293, 'compound': 0.6573}","{'neg': 0.0, 'neu': 1.0, 'pos': 0.0, 'compound': 0.0}"
1,wow hubby sounds nice,BentTorch,PointlessStories,-1,-1,-1,2016-11-01,2016-11-05 16:15:50,i realize that it is possible that i can only be pointless if mostly drunk which is ok except if you asked my husband he would probably say i am mostly pointless all the time,"{'neg': 0.0, 'neu': 0.233, 'pos': 0.767, 'compound': 0.765}","{'neg': 0.072, 'neu': 0.928, 'pos': 0.0, 'compound': -0.34}"
1,she is the one trump supporter,SaltyMeth,leagueoflegends,2,-1,-1,2016-11-01,2016-11-05 16:21:38,how is taliyah a 'token character',"{'neg': 0.0, 'neu': 0.656, 'pos': 0.344, 'compound': 0.2732}","{'neg': 0.0, 'neu': 1.0, 'pos': 0.0, 'compound': 0.0}"
1,yeah not as cool though,Mdgt_Pope,nba,2,-1,-1,2016-11-01,2016-11-05 16:26:58,he is also the guy that took a picture of a shuttle lifting off,"{'neg': 0.274, 'neu': 0.419, 'pos': 0.307, 'compound': 0.0613}","{'neg': 0.0, 'neu': 1.0, 'pos': 0.0, 'compound': 0.0}"
1,ahhh but were not those emails doctored by russia,soss-boss,conspiracy,2,-1,-1,2016-11-01,2016-11-05 16:41:51,yep right in those emails,"{'neg': 0.0, 'neu': 1.0, 'pos': 0.0, 'compound': 0.0}","{'neg': 0.0, 'neu': 0.645, 'pos': 0.355, 'compound': 0.296}"
1,wow what a huge surprise,quartzquandary,todayilearned,-3,-1,-1,2016-11-01,2016-11-05 16:53:41,til only 2 of millennials have excellent credit,"{'neg': 0.0, 'neu': 0.183, 'pos': 0.817, 'compound': 0.8374}","{'neg': 0.0, 'neu': 0.488, 'pos': 0.512, 'compound': 0.743}"
1,just put bad cards into your deck to tech against it,Sipricy,hearthstone,1,-1,-1,2016-11-01,2016-11-05 17:20:53,i particularly have issue with that card that discovers a card from your opponent's deck i saw people suggest this mechanism before and did not think blizzard would take it seriously with these types of mechanisms being pushed more priest does not have to be current shaman tier to be oppressive and extremely annoying,"{'neg': 0.259, 'neu': 0.741, 'pos': 0.0, 'compound': -0.5423}","{'neg': 0.131, 'neu': 0.869, 'pos': 0.0, 'compound': -0.7501}"
1,_[bismillahs]_ straps c4 around waist allahu akbar,5cw21275,exmuslim,7,-1,-1,2016-11-01,2016-11-05 17:25:30,some muslims say that if you say bismillah then the chicken is halal lmao,"{'neg': 0.0, 'neu': 1.0, 'pos': 0.0, 'compound': 0.0}","{'neg': 0.0, 'neu': 0.769, 'pos': 0.231, 'compound': 0.5994}"
1,i really hope that alot of this stuff is,PM_ME_A_BAG_OF_CATS,niceguys,2,-1,-1,2016-11-01,2016-11-05 17:40:02,from askreddit  adjusts tie and sips wine,"{'neg': 0.0, 'neu': 0.715, 'pos': 0.285, 'compound': 0.4927}","{'neg': 0.0, 'neu': 1.0, 'pos': 0.0, 'compound': 0.0}"
1,that is why you went to usc out of hs,fuckbitchesgetmoney1,Browns,1,-1,-1,2016-11-01,2016-11-05 18:10:23,kessler i love cleveland there is no where else i would rather be i love the under dog mentality,"{'neg': 0.0, 'neu': 1.0, 'pos': 0.0, 'compound': 0.0}","{'neg': 0.089, 'neu': 0.569, 'pos': 0.341, 'compound': 0.802}"
1,no i have just been drifting through life not trying to solve any of my problems,Wolfman_beastmachine,depression,8,-1,-1,2016-11-01,2016-11-05 18:24:07,have you tried addressing what makes you feel that way,"{'neg': 0.351, 'neu': 0.649, 'pos': 0.0, 'compound': -0.6696}","{'neg': 0.0, 'neu': 1.0, 'pos': 0.0, 'compound': 0.0}"
1,but america totally wins if were going off nimitz class supercarriers,wargamer620,AskReddit,4,-1,-1,2016-11-01,2016-11-05 18:26:32,right it is completely subjective,"{'neg': 0.0, 'neu': 0.646, 'pos': 0.354, 'compound': 0.7572}","{'neg': 0.0, 'neu': 1.0, 'pos': 0.0, 'compound': 0.0}"
1,we should send him your photo just to be sure,Botogiebu,AskReddit,-7,-1,-1,2016-11-01,2016-11-05 18:48:28,really you think he is never seen a baby before that is a pretty crazy assumption,"{'neg': 0.0, 'neu': 0.796, 'pos': 0.204, 'compound': 0.3182}","{'neg': 0.134, 'neu': 0.668, 'pos': 0.198, 'compound': 0.2869}"
1,yeah because baal runs are more fun and unique than rifts,StunamiBN,diablo3,1,-1,-1,2016-11-01,2016-11-05 19:13:13,its also really going to depend on the cost for the necro my gues is 1995 for the pack which is absurd for the content they are giving would have preferred d2 lod hd personally,"{'neg': 0.0, 'neu': 0.608, 'pos': 0.392, 'compound': 0.6997}","{'neg': 0.0, 'neu': 0.934, 'pos': 0.066, 'compound': 0.34}"
1,yea but it is the nra and they should have no place in public firearm safety protocols,NoobieSnacks,liberalgunowners,2,-1,-1,2016-11-01,2016-11-05 19:17:30,in connecticut in order to receive a pistol permit required to purchase own or carry a handgun along with the application and fingerprint cards you are required to submit a certificate of completion of the nra basic pistol course with a certified and licensed instructor it is not difficult and only takes one day or some instructors spread it out over two weeknights i am in full support of requiring that anyone purchasing a handgun be required to prove that they have some sort of formal training,"{'neg': 0.137, 'neu': 0.683, 'pos': 0.18, 'compound': 0.2263}","{'neg': 0.0, 'neu': 0.945, 'pos': 0.055, 'compound': 0.5873}"
1,second word in the bio,PacoTaco321,Tinder,-1,-1,-1,2016-11-01,2016-11-05 19:23:02,she forgot to mention will accuse you of rape the morning after,"{'neg': 0.0, 'neu': 1.0, 'pos': 0.0, 'compound': 0.0}","{'neg': 0.394, 'neu': 0.606, 'pos': 0.0, 'compound': -0.7579}"
1,those silly women being all emotional,meat_tunnel,TwoXChromosomes,12,-1,-1,2016-11-01,2016-11-05 19:43:43,well men have other standards but still you do not see men react like that,"{'neg': 0.0, 'neu': 0.597, 'pos': 0.403, 'compound': 0.1779}","{'neg': 0.0, 'neu': 0.714, 'pos': 0.286, 'compound': 0.5859}"
1,reported for spam,awesomeethan,ClashRoyale,1,-1,-1,2016-11-01,2016-11-05 19:51:45,there should be a casual mode added to the game most games have a ranked mode and casual mode where your rank does not matter and you just play against people for fun since clash royale has become pretty competitive in it is life time i think it would be a great idea to add something like casual mode right now you can only play ladder tournies and challenges two of which need gems to be played or you join a free tourny but it is incredibly difficult to find one these days ladder is great and all but you get frustrated really quick so i do not see a reason why a casual mode should not be added,"{'neg': 0.556, 'neu': 0.444, 'pos': 0.0, 'compound': -0.3612}","{'neg': 0.068, 'neu': 0.697, 'pos': 0.234, 'compound': 0.9277}"
1,yeah  remival that is situational and completely useless in some matchups is exactly what controlpriest needed,hannes3120,hearthstone,1,-1,-1,2016-11-01,2016-11-05 20:41:08,they do not force priests to play dragons the potions and lightbomb 20 are amazing for control priest,"{'neg': 0.152, 'neu': 0.739, 'pos': 0.108, 'compound': -0.2247}","{'neg': 0.0, 'neu': 0.708, 'pos': 0.292, 'compound': 0.7351}"
1,queue the sprinklers,dinopraso,formula1,2,-1,-1,2016-11-01,2016-11-05 20:54:49,but it does not have the weather factor brazil makes the races much more exciting for that possibility of rain 20070812,"{'neg': 0.0, 'neu': 1.0, 'pos': 0.0, 'compound': 0.0}","{'neg': 0.0, 'neu': 0.8, 'pos': 0.2, 'compound': 0.6946}"
1,windows only has fucking minesweeper,RoundDuckMan,pcmasterrace,14,-1,-1,2016-11-01,2016-11-05 21:34:30,such as tux racer tux racer tux racer and tux racer,"{'neg': 0.0, 'neu': 1.0, 'pos': 0.0, 'compound': 0.0}","{'neg': 0.0, 'neu': 1.0, 'pos': 0.0, 'compound': 0.0}"
1,yeah burn lefty safe spaces and replace them with rightwing safe spaces,RoundDuckMan,politics,5,-1,-1,2016-11-01,2016-11-25 08:06:19,awww did you need a safe space,"{'neg': 0.0, 'neu': 0.529, 'pos': 0.471, 'compound': 0.7906}","{'neg': 0.0, 'neu': 0.674, 'pos': 0.326, 'compound': 0.4404}"
1,yes ladies and gentlemen,MrLordSith,fivenightsatfreddys,1,-1,-1,2016-11-01,2016-11-05 22:01:20,razz is that you,"{'neg': 0.0, 'neu': 0.526, 'pos': 0.474, 'compound': 0.4019}","{'neg': 0.0, 'neu': 1.0, 'pos': 0.0, 'compound': 0.0}"
1,it is so difficult giving tickets it is only natural they start fucking with the underprivileged,jazir5,politics,2,-1,-1,2016-11-01,2016-11-05 22:26:12,wah wah it is so hard to be a cop fuck you,"{'neg': 0.147, 'neu': 0.58, 'pos': 0.273, 'compound': 0.3368}","{'neg': 0.374, 'neu': 0.626, 'pos': 0.0, 'compound': -0.656}"
1,the ebs,KreativeHawk,AskReddit,1,-1,-1,2016-11-01,2016-11-05 23:12:23,what is going to be on the news when this is all over,"{'neg': 0.0, 'neu': 1.0, 'pos': 0.0, 'compound': 0.0}","{'neg': 0.0, 'neu': 1.0, 'pos': 0.0, 'compound': 0.0}"
1,gee i sure am glad this did not have any sound,Bryaxis,interestingasfuck,1,-1,-1,2016-11-01,2016-11-05 23:32:09,3d graphics holograms that floats in mid air just became a real thing,"{'neg': 0.0, 'neu': 0.602, 'pos': 0.398, 'compound': 0.6486}","{'neg': 0.0, 'neu': 1.0, 'pos': 0.0, 'compound': 0.0}"
1,you forget that redditers are rational patient understandable people,Leftovertaters,politics,7,-1,-1,2016-11-01,2016-11-06 01:40:08,maybe people should wait until there are some facts before spewing alarmist crazyness all over the internet with a firehose,"{'neg': 0.192, 'neu': 0.808, 'pos': 0.0, 'compound': -0.2263}","{'neg': 0.0, 'neu': 1.0, 'pos': 0.0, 'compound': 0.0}"
1,but doctors are paid by big pharma to make us spend money on bike helmets,Toxicitor,AskReddit,3,-1,-1,2016-11-01,2016-11-06 02:38:48,tell that to my father who was thrown from his bike and landed so hard his helmet was cracked in half or maybe my boyfriend who was in a hit and run that left him in the hospital for months according to the doctors neither of them would have survived if they had not been wearing helmets,"{'neg': 0.0, 'neu': 1.0, 'pos': 0.0, 'compound': 0.0}","{'neg': 0.032, 'neu': 0.911, 'pos': 0.057, 'compound': 0.3472}"
1,that is debatable,Bad-Science,politics,1,-1,-1,2016-11-01,2016-11-06 04:00:53,100 of those who voted for trump in the primary are human,"{'neg': 0.0, 'neu': 1.0, 'pos': 0.0, 'compound': 0.0}","{'neg': 0.0, 'neu': 1.0, 'pos': 0.0, 'compound': 0.0}"
1,right man so dissapointed there is no dota 3 yet,arefx,Jokes,1,-1,-1,2016-11-01,2016-11-06 04:49:16,valve teaches a kindergarten class to count to three 1 2,"{'neg': 0.235, 'neu': 0.765, 'pos': 0.0, 'compound': -0.3535}","{'neg': 0.0, 'neu': 1.0, 'pos': 0.0, 'compound': 0.0}"
1,or 4000,7StarNat,sports,35,-1,-1,2016-11-01,2016-11-06 05:53:51,or alternatively the first time in 14 billion years,"{'neg': 0.0, 'neu': 1.0, 'pos': 0.0, 'compound': 0.0}","{'neg': 0.0, 'neu': 1.0, 'pos': 0.0, 'compound': 0.0}"
1,its the russians,DwarvenPirate,politics,1,-1,-1,2016-11-01,2016-11-06 06:19:06,the rightwing has congealed around a hysterical conspiracy theoryfueled consensus towards liberals they believe obama and hillary are out to destroy the country one health insurance registration and commonsense tax policy at a time,"{'neg': 0.0, 'neu': 1.0, 'pos': 0.0, 'compound': 0.0}","{'neg': 0.205, 'neu': 0.795, 'pos': 0.0, 'compound': -0.7906}"
1,got to look like i am payin my child support,durpyhoovez,AskReddit,3,-1,-1,2016-11-01,2016-11-06 07:23:09,black people who smoke why is it always menthols,"{'neg': 0.0, 'neu': 0.536, 'pos': 0.464, 'compound': 0.6369}","{'neg': 0.0, 'neu': 1.0, 'pos': 0.0, 'compound': 0.0}"
1,if water goes into water the water just keeps going to the ground di'dnt ya know,Krautbaron,unturned,1,-1,-1,2016-11-01,2016-11-06 07:42:47,this is some spongebob level shit man,"{'neg': 0.0, 'neu': 1.0, 'pos': 0.0, 'compound': 0.0}","{'neg': 0.375, 'neu': 0.625, 'pos': 0.0, 'compound': -0.5574}"
1,cuz that is gay duh,agomezian,nba,5,-1,-1,2016-11-01,2016-11-06 07:49:25,why is it weird for a dude to call another dude handsome but girls call other girls beautiful all the time,"{'neg': 0.0, 'neu': 1.0, 'pos': 0.0, 'compound': 0.0}","{'neg': 0.05, 'neu': 0.672, 'pos': 0.278, 'compound': 0.7964}"
1,something something dwight has 12 kids,objectiveye,nba,1,-1,-1,2016-11-01,2016-11-06 08:29:08,dwight always starts off not shit then it goes to shit,"{'neg': 0.0, 'neu': 1.0, 'pos': 0.0, 'compound': 0.0}","{'neg': 0.232, 'neu': 0.58, 'pos': 0.188, 'compound': -0.1719}"
1,had to check post history to see if,charging_bull,politics,2,-1,-1,2016-11-01,2016-11-06 12:08:25,why is no one talking about how bill raped and email in benghazi and gave it parkinson's disease the email could not keep the affair condential so hillary sacrificed her in a blood ritual to satan and then declared war on the canned foods section at a grocery store to take out the pickle jar who was going to leak the story,"{'neg': 0.0, 'neu': 1.0, 'pos': 0.0, 'compound': 0.0}","{'neg': 0.187, 'neu': 0.813, 'pos': 0.0, 'compound': -0.9201}"
1,must be hard living life being so damn tall,BabyJesusStig,pcmasterrace,2,-1,-1,2016-11-01,2016-11-06 14:11:00,my own battlestation lt3,"{'neg': 0.411, 'neu': 0.589, 'pos': 0.0, 'compound': -0.5982}","{'neg': 0.0, 'neu': 1.0, 'pos': 0.0, 'compound': 0.0}"
1,the eye cannot see faster than 24fps anyways though so what does it matter,highrollingneon,pcmasterrace,6,-1,-1,2016-11-01,2016-11-06 14:54:44,misguided peasants,"{'neg': 0.0, 'neu': 0.922, 'pos': 0.078, 'compound': 0.0258}","{'neg': 0.0, 'neu': 1.0, 'pos': 0.0, 'compound': 0.0}"
1,op nerf pls,Heyyoguy123,battlefield_one,1,-1,-1,2016-11-01,2016-11-06 15:01:35,val browning with a bar in the argonne offensive,"{'neg': 0.0, 'neu': 0.557, 'pos': 0.443, 'compound': 0.1511}","{'neg': 0.273, 'neu': 0.727, 'pos': 0.0, 'compound': -0.4588}"
1,id rather have rashford,DMP96,reddevils,1,-1,-1,2016-11-01,2016-11-06 15:23:13,zlatan 20,"{'neg': 0.0, 'neu': 1.0, 'pos': 0.0, 'compound': 0.0}","{'neg': 0.0, 'neu': 1.0, 'pos': 0.0, 'compound': 0.0}"
1,everything was better back when we used practical effects,Otterable,Unexpected,16,-1,-1,2016-11-01,2016-11-06 15:31:39,it is cgi,"{'neg': 0.0, 'neu': 0.734, 'pos': 0.266, 'compound': 0.4404}","{'neg': 0.0, 'neu': 1.0, 'pos': 0.0, 'compound': 0.0}"
1,i feel scolded ,ObamaVapes,hardwareswap,1,-1,-1,2016-11-01,2016-11-06 16:03:33,i think he is just using the words you and i to prove a point i do not think he is actually scolding that user,"{'neg': 0.492, 'neu': 0.508, 'pos': 0.0, 'compound': -0.4404}","{'neg': 0.0, 'neu': 1.0, 'pos': 0.0, 'compound': 0.0}"
1,you dropped this,Lurksville,politics,0,-1,-1,2016-11-01,2016-11-06 16:15:28,because she does not screw people over,"{'neg': 0.0, 'neu': 1.0, 'pos': 0.0, 'compound': 0.0}","{'neg': 0.0, 'neu': 0.794, 'pos': 0.206, 'compound': 0.0762}"
1,yeah once you get the expensive two iron to make shears,SendineisTheParadox,minecraftsuggestions,1,-1,-1,2016-11-01,2016-11-06 16:49:39,would not this like make feathers obsolete,"{'neg': 0.0, 'neu': 0.82, 'pos': 0.18, 'compound': 0.296}","{'neg': 0.519, 'neu': 0.481, 'pos': 0.0, 'compound': -0.5122}"
1,yeah hubby was soooooo fun to be around for about 2 wks,IceQueen79,AskReddit,1,-1,-1,2016-11-01,2016-11-06 16:57:50,i had a prof in college who drank a 24 pack a day of the stuff doctor made him stop and he had full on withdrawal symptoms for a while after that shit is no bueno,"{'neg': 0.0, 'neu': 0.645, 'pos': 0.355, 'compound': 0.6705}","{'neg': 0.195, 'neu': 0.779, 'pos': 0.027, 'compound': -0.7845}"
1,now that is what i call constructive criticism,Ardub23,pokemon,6,-1,-1,2016-11-01,2016-11-06 17:44:06,lame,"{'neg': 0.326, 'neu': 0.674, 'pos': 0.0, 'compound': -0.4404}","{'neg': 1.0, 'neu': 0.0, 'pos': 0.0, 'compound': -0.4215}"
1,do not throw your logic at him,SaltyDevil91,Rainbow6,2,-1,-1,2016-11-01,2016-11-06 18:03:51,it is being covered by your reticle,"{'neg': 0.0, 'neu': 1.0, 'pos': 0.0, 'compound': 0.0}","{'neg': 0.0, 'neu': 1.0, 'pos': 0.0, 'compound': 0.0}"
1,what happened to the element of surprise,Fugue_Slate,worldnews,1,-1,-1,2016-11-01,2016-11-06 19:28:12,sometimes you release information like this to get people to panic react and then move you say sas has a hit list and then you listen to chatter and see what members isis thinks it is who is valuable you watch and see who tries to move positions etc,"{'neg': 0.0, 'neu': 0.741, 'pos': 0.259, 'compound': 0.2732}","{'neg': 0.06, 'neu': 0.838, 'pos': 0.102, 'compound': 0.3182}"
1,sure  for n girls just approach n1,CatanOverlord,mcgill,3,-1,-1,2016-11-01,2016-11-06 20:06:12,just do not be the guy at gerts yesterday who went up to every single girl sequentially asking to join,"{'neg': 0.0, 'neu': 0.753, 'pos': 0.247, 'compound': 0.3182}","{'neg': 0.0, 'neu': 0.891, 'pos': 0.109, 'compound': 0.296}"
1,but but he throws deep,Gnux13,nfl,3,-1,-1,2016-11-01,2016-11-06 20:26:31,that is two weeks in a row foles has missed a wide open receiver on a sure td although i do not think there is really going to be a big qb controversy among the fans after this week anyway,"{'neg': 0.0, 'neu': 1.0, 'pos': 0.0, 'compound': 0.0}","{'neg': 0.056, 'neu': 0.886, 'pos': 0.058, 'compound': 0.0258}"
1,it worked when wentz was in college it must work in the nfl,mago184,eagles,1,-1,-1,2016-11-01,2016-11-06 20:53:17,what the fuck in the game tape told doug that qb draws were going to work and why does he keep trying it even after it gets fucked each time,"{'neg': 0.0, 'neu': 1.0, 'pos': 0.0, 'compound': 0.0}","{'neg': 0.228, 'neu': 0.772, 'pos': 0.0, 'compound': -0.8504}"
1,lol yeah that will sort the place out,Soviet_water,kansascity,3,-1,-1,2016-11-01,2016-11-06 20:54:45,yeah a strict dress code will fix everything,"{'neg': 0.0, 'neu': 0.531, 'pos': 0.469, 'compound': 0.6476}","{'neg': 0.0, 'neu': 0.761, 'pos': 0.239, 'compound': 0.296}"
