label,comment,author,subreddit,score,ups,downs,date,created_utc,parent_comment,vader_comment,vader_pcomment
0,i was super bummed thatw waselected in 2000 but i would never ever everrrrrr disrespect the president  any us potus in such a way,beanx,The_Donald,3,-1,-1,2016-12-01,2016-12-09 03:31:27,there were cucks against bush in 2000 and 2004 i do not like bush by the way they threw eggs at bush's limo in 2004 i think relax all of you people and just trust the usss and these bikers to keep the peace there,"{'neg': 0.0, 'neu': 0.798, 'pos': 0.202, 'compound': 0.7017}","{'neg': 0.042, 'neu': 0.763, 'pos': 0.195, 'compound': 0.822}"
0,at least dade is in lpl,Altark98,leagueoflegends,1,-1,-1,2016-11-01,2016-11-14 02:39:27,burried in a grave filled with chinese money and hunnies next to dade,"{'neg': 0.0, 'neu': 1.0, 'pos': 0.0, 'compound': 0.0}","{'neg': 0.178, 'neu': 0.822, 'pos': 0.0, 'compound': -0.3818}"
0,i would have said when code grass s3 is announced but s3 has been announced so i cannot use that anymore ,AaTheHero,anime_irl,1,-1,-1,2016-12-01,2016-12-16 13:38:37,when no game no life s2 comes out,"{'neg': 0.155, 'neu': 0.845, 'pos': 0.0, 'compound': -0.5927}","{'neg': 0.218, 'neu': 0.595, 'pos': 0.187, 'compound': -0.0803}"
1,oh but did not you know being in a relationship means you totally have to just put up with their broke ass being a broke ass all the time,murderousbudgie,AskReddit,2,-1,-1,2016-11-01,2016-11-01 19:41:04,to be fair anyone you have to nag for a rent payment should find somewhere else to live,"{'neg': 0.413, 'neu': 0.587, 'pos': 0.0, 'compound': -0.9578}","{'neg': 0.12, 'neu': 0.769, 'pos': 0.111, 'compound': -0.0516}"
0,by the way if people want to try this however you can wear the charged tome of fire only takes 1 page to charge and mist battlestaff to get infinite air water and fire runes,darealbeast,2007scape,2,2,0,2016-09-01,2016-09-29 00:48:22,i have tested bringing this third spell into the mix however i would personally not recommend it there is specific timing required for the spin flax spell and adding another strange timing factor into it does increase xphr but only by about 6 and decreases the already lowish profit you make from spin flax  tan leather method,"{'neg': 0.179, 'neu': 0.786, 'pos': 0.035, 'compound': -0.6486}","{'neg': 0.083, 'neu': 0.831, 'pos': 0.086, 'compound': 0.2948}"
0,i am glad you left too,OMGWTFBBQUE,gifs,4,-1,-1,2016-11-01,2016-11-23 14:32:23,glad i left that shit hole,"{'neg': 0.0, 'neu': 0.549, 'pos': 0.451, 'compound': 0.5093}","{'neg': 0.34, 'neu': 0.377, 'pos': 0.283, 'compound': -0.1531}"
0,why did you not provide any proof or comparison,JakeTheSnakes11,Whatcouldgowrong,0,-1,-1,2016-11-01,2016-11-30 03:38:57,did i say only,"{'neg': 0.0, 'neu': 1.0, 'pos': 0.0, 'compound': 0.0}","{'neg': 0.0, 'neu': 1.0, 'pos': 0.0, 'compound': 0.0}"
0,indiana jones and the crystal skull,Hammonkey,movies,1,1,0,2016-09-01,2016-09-17 23:31:16,what was the other one,"{'neg': 0.0, 'neu': 1.0, 'pos': 0.0, 'compound': 0.0}","{'neg': 0.0, 'neu': 1.0, 'pos': 0.0, 'compound': 0.0}"
0,alt universe mccauley culkin,iamyourlager,television,42,42,0,2016-09-01,2016-09-06 16:22:12,i hope they scrap murphy after this season though he serves no real purpose after escobar would have been better if carillo was around as one of the main protagonists to take on the cali cartel,"{'neg': 0.0, 'neu': 1.0, 'pos': 0.0, 'compound': 0.0}","{'neg': 0.054, 'neu': 0.805, 'pos': 0.141, 'compound': 0.5574}"
0,noon for us but that is because we are an advanced with other events outside of magic,Nindzya,magicTCG,1,-1,-1,2016-12-01,2016-12-04 21:30:23,i just wish they added it as a part of fnm rather than a separate day i have enough trouble getting out for one night of magic a week also what times do your guys' stores do the event because my store thought it was a decent idea at 2pm,"{'neg': 0.0, 'neu': 0.848, 'pos': 0.152, 'compound': 0.3612}","{'neg': 0.051, 'neu': 0.899, 'pos': 0.051, 'compound': 0.0}"
0,dude still probably has not recovered,26FtW26,AskReddit,178,-1,-1,2016-12-01,2016-12-03 19:44:13,yeah that guy will not recover for a while,"{'neg': 0.0, 'neu': 1.0, 'pos': 0.0, 'compound': 0.0}","{'neg': 0.0, 'neu': 0.761, 'pos': 0.239, 'compound': 0.296}"
1,yea that is not demeaning to women at all,frombildgewater,The_Donald,3,-1,-1,2016-11-01,2016-11-01 19:51:38,i saw it described once that boys are for fun women are for babies you can also sboysgoats and it is probably still true,"{'neg': 0.0, 'neu': 1.0, 'pos': 0.0, 'compound': 0.0}","{'neg': 0.0, 'neu': 0.775, 'pos': 0.225, 'compound': 0.7269}"
0,spotted the canadian,yosayoran,pokemongo,2,2,0,2016-09-01,2016-09-04 00:03:56,what are you guys talking a boat,"{'neg': 0.0, 'neu': 1.0, 'pos': 0.0, 'compound': 0.0}","{'neg': 0.0, 'neu': 1.0, 'pos': 0.0, 'compound': 0.0}"
0,it is just coughing and weird faces,Middleman79,HillaryForPrison,57,57,0,2016-09-01,2016-09-09 18:57:19,being forced to watch a hitlery speech is cruel and unusual punishment time to lawyer up,"{'neg': 0.254, 'neu': 0.746, 'pos': 0.0, 'compound': -0.1779}","{'neg': 0.435, 'neu': 0.565, 'pos': 0.0, 'compound': -0.875}"
0,you look like the love child of zachary morris and that trailer park girl he did not want anyone to find out about,TheLastOne0001,RoastMe,1,-1,-1,2016-11-01,2016-11-18 10:26:45,he does not think you can roast him,"{'neg': 0.045, 'neu': 0.706, 'pos': 0.249, 'compound': 0.7564}","{'neg': 0.0, 'neu': 1.0, 'pos': 0.0, 'compound': 0.0}"
0,which one has the trashiest tattoos,quad64bit,shittytattoos,3,-1,-1,2016-11-01,2016-11-01 20:00:47,it is also a neighborhood in san diego and a beach in san francisco,"{'neg': 0.0, 'neu': 1.0, 'pos': 0.0, 'compound': 0.0}","{'neg': 0.0, 'neu': 1.0, 'pos': 0.0, 'compound': 0.0}"
0,9p starts with 20 and can upgrade to 23 and then 37 9ut starts with 23 and upgrades to 37 then 45,skippythemoonrock,Warthunder,3,-1,-1,2016-12-01,2016-12-03 17:28:06,yep yak9ut also has 3 loadouts for guns 2x20 and 23 2x20 and 37 2x20 and 45 or was it the yak9p,"{'neg': 0.0, 'neu': 1.0, 'pos': 0.0, 'compound': 0.0}","{'neg': 0.0, 'neu': 0.905, 'pos': 0.095, 'compound': 0.296}"
0,fair and i bet if he would have included a classified piece separately in the email he could get the entire email blocked from public release,ArchonOfLight12,politics,1,-1,-1,2016-11-01,2016-11-01 20:01:38,to be honest i do not know but i do know the director of the fbi should know how,"{'neg': 0.074, 'neu': 0.845, 'pos': 0.081, 'compound': 0.0516}","{'neg': 0.0, 'neu': 0.888, 'pos': 0.112, 'compound': 0.2846}"
0,battlefront,ATouchOfKiwi,pcmasterrace,1,-1,-1,2016-12-01,2016-12-25 21:52:10,for 3 years i have been playing on a laptop  what have i missed today was a good day i have been playing solely pc for 3 years running integrated graphics and an i3 it overheats runs cs at less than 60 frames let us just say i have missed a lot when it comes to gaming now i have ascended  a beautiful machine with an i7 and 1080  what have i missed what games have beautiful graphics what story have i not played because my computer could not handle it psst  i am asking for you to recommend games,"{'neg': 1.0, 'neu': 0.0, 'pos': 0.0, 'compound': -0.296}","{'neg': 0.076, 'neu': 0.768, 'pos': 0.156, 'compound': 0.8749}"
0,cs 16 source and go cities skylines getting steep in a bit,ATouchOfKiwi,pcmasterrace,2,-1,-1,2016-12-01,2016-12-27 08:27:33,who got what from the steam sale i will start  doom  witcher 3  xcom 2  shadow of mordor  mortal kombat x  portal 2  divinity org sin  shadowrun returns  ftl i recon i am set for a while trouble is i have started with ftl and i am hooked,"{'neg': 0.0, 'neu': 1.0, 'pos': 0.0, 'compound': 0.0}","{'neg': 0.15, 'neu': 0.79, 'pos': 0.06, 'compound': -0.68}"
0,or a your welcome,Zer0DotFive,Overwatch,1,-1,-1,2016-11-01,2016-11-07 18:36:05,can we have a sorry in the context menu or a hotkey i often do mistakes and i want to apologise to my team for when i do something dumb please blizzard this is my one request,"{'neg': 0.0, 'neu': 0.5, 'pos': 0.5, 'compound': 0.4588}","{'neg': 0.166, 'neu': 0.695, 'pos': 0.139, 'compound': -0.2942}"
1,but i want it to charge super fast,mrwhitewalker,GooglePixel,1,-1,-1,2016-11-01,2016-11-01 20:05:45,it does not bother me actually its a nonissue for consumers but still weird that they chose to market it wonder why,"{'neg': 0.0, 'neu': 0.458, 'pos': 0.542, 'compound': 0.7959}","{'neg': 0.091, 'neu': 0.842, 'pos': 0.067, 'compound': -0.1361}"
0,right but i do not think it makes sense to compare the mars vehicle to the shuttle with the booster attached,Yanqui-UXO,space,8,8,0,2016-09-01,2016-09-28 05:20:15,the shuttle orbiter is 37 meters long so the spacex mars vehicle is about three times as long and many more times as massive,"{'neg': 0.0, 'neu': 1.0, 'pos': 0.0, 'compound': 0.0}","{'neg': 0.0, 'neu': 1.0, 'pos': 0.0, 'compound': 0.0}"
0,hard drive requirements tend to include extra space for the file unpacking,KillAllTheThings,arma,1,-1,-1,2016-11-01,2016-11-01 20:07:57,system requirements always tend to be estimates,"{'neg': 0.113, 'neu': 0.887, 'pos': 0.0, 'compound': -0.1027}","{'neg': 0.0, 'neu': 1.0, 'pos': 0.0, 'compound': 0.0}"
0,definitely going in my brago deck to hunt up swords  blink  sword  blink  sword  blink  sword d d d by your powers combinedhe is captain voltron,Window_bait,EDH,19,-1,-1,2016-11-01,2016-11-29 20:33:38,for sure will be replacing [[drift of phantasms]] in my lazav it only ever searches up swords,"{'neg': 0.0, 'neu': 0.65, 'pos': 0.35, 'compound': 0.9441}","{'neg': 0.0, 'neu': 0.874, 'pos': 0.126, 'compound': 0.3182}"
0,then do not downgrade if you want to play with everyone else,pm_me_your_furnaces,Games,3,-1,-1,2016-10-01,2016-10-06 07:29:03,this does not make sense for multiplayer games their network protocol or local simulation may work differently for each version,"{'neg': 0.0, 'neu': 0.709, 'pos': 0.291, 'compound': 0.4019}","{'neg': 0.0, 'neu': 1.0, 'pos': 0.0, 'compound': 0.0}"
0,wife got a forester over a tiguan a few months ago,Baltorussian,extdi,1,-1,-1,2016-11-01,2016-11-01 20:09:49,you have no idea what you are going to get good for you not many people can admit that they do not know the answers to questions they have take a hard look at what your needs and wants are those needs and wants should guide you to your next vehicle which vw is conveniently handing you a remarkable opportunity to get your own needs and wants will differ from other people's wants and needs so the better you can articulate what your needs and wants are the better decision you will eventually come to as for myself i discovered my subaru bigotry and got a forester,"{'neg': 0.0, 'neu': 1.0, 'pos': 0.0, 'compound': 0.0}","{'neg': 0.03, 'neu': 0.823, 'pos': 0.147, 'compound': 0.9309}"
0,sure you can remove the hdd and get a bigger ssd,Kyetsi,pcmasterrace,2,-1,-1,2016-11-01,2016-11-23 19:22:12,just want to know if i can improve anything without raising the price,"{'neg': 0.0, 'neu': 0.813, 'pos': 0.187, 'compound': 0.3182}","{'neg': 0.0, 'neu': 0.791, 'pos': 0.209, 'compound': 0.4404}"
0,only good thing about consoles is their controllers i really like playing with a xbox controller on pc but that is partly because my desk is shit so when i play with keyboardmouse i sit so close to the monitor it makes my eyes hurt after a while lol,Kyetsi,pcmasterrace,6,-1,-1,2016-10-01,2016-10-15 21:24:14,having the choice to kick back and put your feet up when having a pc is the best,"{'neg': 0.151, 'neu': 0.65, 'pos': 0.199, 'compound': 0.021}","{'neg': 0.0, 'neu': 0.802, 'pos': 0.198, 'compound': 0.6369}"
0,it is like people forget he is been in the league 13 years,Clutch_,nba,18,-1,-1,2016-11-01,2016-11-13 02:37:54,does not that happen when you get older,"{'neg': 0.142, 'neu': 0.672, 'pos': 0.187, 'compound': 0.1531}","{'neg': 0.0, 'neu': 1.0, 'pos': 0.0, 'compound': 0.0}"
0,but this is just caused by muh goburnment intervention dirty corporatists,Sikletrynet,LateStageCapitalism,29,-1,-1,2016-12-01,2016-12-07 18:25:56,stare at this graph until you no longer believe markets are free,"{'neg': 0.278, 'neu': 0.722, 'pos': 0.0, 'compound': -0.5927}","{'neg': 0.142, 'neu': 0.645, 'pos': 0.213, 'compound': 0.2732}"
0,all sere school grads,Bikemancs_at_work,army,7,-1,-1,2016-11-01,2016-11-01 20:13:48,california national guard cannot find some 4000 soldiers who received improper pay,"{'neg': 0.0, 'neu': 1.0, 'pos': 0.0, 'compound': 0.0}","{'neg': 0.113, 'neu': 0.887, 'pos': 0.0, 'compound': -0.1027}"
1,yea because kobbe was so much better,TheDawnWeeps,leagueoflegends,1,-1,-1,2016-11-01,2016-11-01 20:14:26,basically any eu adc would be better than international chocke lift,"{'neg': 0.0, 'neu': 0.654, 'pos': 0.346, 'compound': 0.4902}","{'neg': 0.0, 'neu': 0.775, 'pos': 0.225, 'compound': 0.4404}"
0,what is the secret,k4mon,Overwatch,1,-1,-1,2016-11-01,2016-11-01 20:16:00,dia de los muertos viva mexico dia de los muertos viva mexico dia de los muertos viva mexico dia de los muertos viva mexico,"{'neg': 0.0, 'neu': 1.0, 'pos': 0.0, 'compound': 0.0}","{'neg': 0.0, 'neu': 1.0, 'pos': 0.0, 'compound': 0.0}"
0,you just said it was due to anxiety,lucyinthesky8XX,vandwellers,1,-1,-1,2016-11-01,2016-11-01 20:16:21,that is why i pushed it off need the van first,"{'neg': 0.195, 'neu': 0.805, 'pos': 0.0, 'compound': -0.1779}","{'neg': 0.0, 'neu': 1.0, 'pos': 0.0, 'compound': 0.0}"
0,you are right we should never build anything ever because it might fail at some point and because problems,Augustus_Caesar1,politics,2,-1,-1,2016-11-01,2016-11-25 18:23:51,if it does it will be bad i do not understand your logic at all it is like if there is not a 100 chance of happening everything is fine huh that is why you take preventative measures for anything there is a chance it will happen why wear a seatbelt when you may or may not crash today,"{'neg': 0.279, 'neu': 0.721, 'pos': 0.0, 'compound': -0.7351}","{'neg': 0.083, 'neu': 0.756, 'pos': 0.161, 'compound': 0.6138}"
0,but her niece is not running yet,rigbed,The_Donald,2,-1,-1,2016-11-01,2016-11-19 03:26:15,her niece is even better,"{'neg': 0.0, 'neu': 1.0, 'pos': 0.0, 'compound': 0.0}","{'neg': 0.0, 'neu': 0.58, 'pos': 0.42, 'compound': 0.4404}"
0,is your dad a cat,miraculous-,Showerthoughts,3,-1,-1,2016-11-01,2016-11-22 02:29:36,my dad sleeps 16 hours a day and is in his pajamas until 5 pm after which he changes into another pair of pajamas,"{'neg': 0.0, 'neu': 1.0, 'pos': 0.0, 'compound': 0.0}","{'neg': 0.0, 'neu': 1.0, 'pos': 0.0, 'compound': 0.0}"
0,kek,StormSurge9,dankmemes,2,-1,-1,2016-10-01,2016-10-20 03:58:35,kekkity kek,"{'neg': 0.0, 'neu': 1.0, 'pos': 0.0, 'compound': 0.0}","{'neg': 0.0, 'neu': 1.0, 'pos': 0.0, 'compound': 0.0}"
0,i will never hear the end of being called cute will i,dreamingofcthulhu,furry_irl,2,-1,-1,2016-11-01,2016-11-18 05:00:48,you have but i will never get tired of hearing it especially from someone so fucking cute,"{'neg': 0.0, 'neu': 0.769, 'pos': 0.231, 'compound': 0.4588}","{'neg': 0.0, 'neu': 0.607, 'pos': 0.393, 'compound': 0.8769}"
0,and then looked at whatever you call that,GN_Austin,fnafcringe,1,-1,-1,2016-11-01,2016-11-11 16:02:59,you drank too much coke ,"{'neg': 0.0, 'neu': 1.0, 'pos': 0.0, 'compound': 0.0}","{'neg': 0.0, 'neu': 0.725, 'pos': 0.275, 'compound': 0.2263}"
0,loads of chinese syndras go it for the extra dmg on ionia,iryuuk,leagueoflegends,1,1,0,2016-09-01,2016-09-04 07:41:51,you make syndra players fucking sick go back to bronze v luden's echo has no place in a build for syndra,"{'neg': 0.0, 'neu': 1.0, 'pos': 0.0, 'compound': 0.0}","{'neg': 0.234, 'neu': 0.766, 'pos': 0.0, 'compound': -0.6997}"
0,other than his stance on border security and extreme vetting on people immigrating from countries where isis currently reside and operate from what makes trump a racist monster,Fake_Virtanen,worldpolitics,11,-1,-1,2016-11-01,2016-11-01 20:32:57,that is kind of her whole thing she is corrupt as fuck he is a racist monster we are circling the drain with this one,"{'neg': 0.123, 'neu': 0.802, 'pos': 0.074, 'compound': -0.3818}","{'neg': 0.283, 'neu': 0.717, 'pos': 0.0, 'compound': -0.8176}"
0,the seasons before they did this were absolute worst seasons they ever made,Skylightt,southpark,11,-1,-1,2016-12-01,2016-12-01 14:04:47,last couple season's fucking sucked they need to stop with the one season storylines,"{'neg': 0.255, 'neu': 0.745, 'pos': 0.0, 'compound': -0.6249}","{'neg': 0.314, 'neu': 0.686, 'pos': 0.0, 'compound': -0.6697}"
0,115 from black ops 1 zombies,Tex_DUBB,AskReddit,1,-1,-1,2016-11-01,2016-11-21 16:50:01,gamers of reddit what is your favorite original song from any game's soundtrack,"{'neg': 0.0, 'neu': 1.0, 'pos': 0.0, 'compound': 0.0}","{'neg': 0.0, 'neu': 0.675, 'pos': 0.325, 'compound': 0.6486}"
0,also because,SirAxolotlTheThird,pcmasterrace,1,-1,-1,2016-11-01,2016-11-12 12:38:22,you are,"{'neg': 0.0, 'neu': 1.0, 'pos': 0.0, 'compound': 0.0}","{'neg': 0.0, 'neu': 1.0, 'pos': 0.0, 'compound': 0.0}"
0,out of curiosity what does it do,greenpeppers100,HowToHack,-3,-1,-1,2016-11-01,2016-11-15 23:43:51,how to install and use blacknurse dos on kali linux,"{'neg': 0.0, 'neu': 1.0, 'pos': 0.0, 'compound': 0.0}","{'neg': 0.0, 'neu': 1.0, 'pos': 0.0, 'compound': 0.0}"
0,you were being misled in high school,Reddit_beard,funny,2,-1,-1,2016-12-01,2016-12-21 00:11:32,i remember my freshman year of highschool we were taught the global warming was a theory by freshman year of college it was fact i think it is pretty cool how fast things change,"{'neg': 0.0, 'neu': 1.0, 'pos': 0.0, 'compound': 0.0}","{'neg': 0.0, 'neu': 0.809, 'pos': 0.191, 'compound': 0.7269}"
0,where do you live lmao,TheFunnySmiley,teenagers,12,-1,-1,2016-11-01,2016-11-08 19:58:06,it is the second time i see a nazi car in my neighborhood,"{'neg': 0.0, 'neu': 0.506, 'pos': 0.494, 'compound': 0.5994}","{'neg': 0.0, 'neu': 1.0, 'pos': 0.0, 'compound': 0.0}"
0,were those who boycotted south africa and only south africa where they considered racist,stainorstreak,worldnews,1,-1,-1,2016-11-01,2016-11-02 18:23:29,if someone boycotted every muslim nation and no other nation then my presumption and many other's presumption would be that person is an islamaphobe i do not think that is unreasonable,"{'neg': 0.358, 'neu': 0.642, 'pos': 0.0, 'compound': -0.7717}","{'neg': 0.154, 'neu': 0.846, 'pos': 0.0, 'compound': -0.5994}"
1,i might have dropped this,DRN1NJ4,tiltshift,10,-1,-1,2016-11-01,2016-11-01 20:41:44,i have literally never heard of anyone call them planeways,"{'neg': 0.0, 'neu': 1.0, 'pos': 0.0, 'compound': 0.0}","{'neg': 0.0, 'neu': 1.0, 'pos': 0.0, 'compound': 0.0}"
0,possibly however the internet is definitely opening our eyes to sexuality at a much younger age,emoposer,AskReddit,19,19,0,2016-09-01,2016-09-05 03:31:09,i suspect that has more to do with having older siblings or poor parental supervision no 5 year old is going to know what fucking a girl in the ass means or even think about anal sex unless some else older tells him about it,"{'neg': 0.0, 'neu': 0.847, 'pos': 0.153, 'compound': 0.4019}","{'neg': 0.212, 'neu': 0.788, 'pos': 0.0, 'compound': -0.875}"
1,i am just going to subsist on g fuel all weekend,bookpizza,Infinitewarfare,4,-1,-1,2016-11-01,2016-11-01 21:40:45,protein shakes easy and no chewing involved just sip between killcams,"{'neg': 0.0, 'neu': 1.0, 'pos': 0.0, 'compound': 0.0}","{'neg': 0.156, 'neu': 0.638, 'pos': 0.206, 'compound': 0.1779}"
1,vayne,Onam3000,leagueoflegends,0,-1,-1,2016-11-01,2016-11-01 22:00:13,so now every ability deals true damage who is the strongest champion,"{'neg': 0.0, 'neu': 1.0, 'pos': 0.0, 'compound': 0.0}","{'neg': 0.143, 'neu': 0.313, 'pos': 0.544, 'compound': 0.8387}"
1,yes switzerland's black ops are pulling off special operations all around the world protect its citizens high standard of living,exo762,Bitcoin,8,-1,-1,2016-11-01,2016-11-01 23:04:08,it amuses me the way you can armchair opinions on world affairs not having any insight into what it takes to keep the interests that allow you to enjoy a cozy life safe,"{'neg': 0.0, 'neu': 0.68, 'pos': 0.32, 'compound': 0.7906}","{'neg': 0.0, 'neu': 0.688, 'pos': 0.312, 'compound': 0.8934}"
1,hillary clinton is a saint,Nostalgia_Novacane,rant,7,-1,-1,2016-11-01,2016-11-08 07:05:42,trump is an idiot and so is anyone who supports him go fuck yourselves,"{'neg': 0.0, 'neu': 1.0, 'pos': 0.0, 'compound': 0.0}","{'neg': 0.335, 'neu': 0.542, 'pos': 0.123, 'compound': -0.6486}"
1,fuck anyone from nj,Nostalgia_Novacane,The_Donald,7,-1,-1,2016-11-01,2016-11-16 06:08:26,living in njfuck that guy,"{'neg': 0.538, 'neu': 0.462, 'pos': 0.0, 'compound': -0.5423}","{'neg': 0.0, 'neu': 1.0, 'pos': 0.0, 'compound': 0.0}"
1,got to save our children from the dangers of text on a screen in a rhythm game,cottoneyes,osugame,9,-1,-1,2016-11-01,2016-11-01 23:34:52,why the fuck were you letting an 9 year old have an account in a game like this and also why the fuck would you let him talk in the osu chat which probably has some creeps in it,"{'neg': 0.157, 'neu': 0.686, 'pos': 0.157, 'compound': 0.0}","{'neg': 0.154, 'neu': 0.791, 'pos': 0.055, 'compound': -0.6705}"
1,sec wins count twice to the committee,spiralingoutofcontrl,CFB,7,-1,-1,2016-11-01,2016-11-01 23:44:33,and michigan has wins vs 8 wisconsin 12 psu and 15 colorado does not seem like those are worse wins,"{'neg': 0.0, 'neu': 0.619, 'pos': 0.381, 'compound': 0.5719}","{'neg': 0.189, 'neu': 0.543, 'pos': 0.268, 'compound': 0.4922}"
1,ahh the glorious american cuisine,dr_obfuscation,oddlysatisfying,1,-1,-1,2016-11-01,2016-11-02 00:45:58,this grocery aisle,"{'neg': 0.0, 'neu': 0.488, 'pos': 0.512, 'compound': 0.6369}","{'neg': 0.0, 'neu': 1.0, 'pos': 0.0, 'compound': 0.0}"
1,i am more curious of how the coffee is burnt,savagexopress,Rainbow6,2,-1,-1,2016-11-01,2016-11-02 01:20:34,the proper way to start your siege session,"{'neg': 0.0, 'neu': 0.755, 'pos': 0.245, 'compound': 0.3804}","{'neg': 0.0, 'neu': 1.0, 'pos': 0.0, 'compound': 0.0}"
1,it just never stops being funny guys,Grind2ock,MMA,2,-1,-1,2016-11-01,2016-11-02 02:17:32,well he was 420 at the presser after the fight,"{'neg': 0.272, 'neu': 0.565, 'pos': 0.163, 'compound': -0.2411}","{'neg': 0.205, 'neu': 0.63, 'pos': 0.165, 'compound': -0.128}"
1,because society tells them to our they are not cool,Techiastronamo,funny,-3,-1,-1,2016-11-01,2016-11-02 02:43:43,why does anyone buy any apple product at all i just do not get it,"{'neg': 0.197, 'neu': 0.803, 'pos': 0.0, 'compound': -0.2411}","{'neg': 0.0, 'neu': 1.0, 'pos': 0.0, 'compound': 0.0}"
1,damn karma whores,Tullyswimmer,hockey,2,-1,-1,2016-11-01,2016-11-02 03:10:57,nic delauriers gets hungry before the game,"{'neg': 0.87, 'neu': 0.13, 'pos': 0.0, 'compound': -0.7717}","{'neg': 0.0, 'neu': 1.0, 'pos': 0.0, 'compound': 0.0}"
1,teams should just perpetually keep us on the power play that way they shut us out every time,fauxfoxes,FloridaPanthers,1,-1,-1,2016-11-01,2016-11-02 03:14:34,post game thread florida panthers vs boston bruins 1112016 we need some chemistry on our lines that is the way to fix scoring,"{'neg': 0.0, 'neu': 0.863, 'pos': 0.137, 'compound': 0.4003}","{'neg': 0.0, 'neu': 1.0, 'pos': 0.0, 'compound': 0.0}"
1,she should just get out of the way so the spoiled corrupt taxdodging draftdodging groping lying alleged child rapist can be president,FredFredrickson,politics,6,-1,-1,2016-11-01,2016-11-02 03:19:07,that is a wrap folks some random fuck lady said hillary should be disqualified election is over,"{'neg': 0.293, 'neu': 0.707, 'pos': 0.0, 'compound': -0.8519}","{'neg': 0.31, 'neu': 0.69, 'pos': 0.0, 'compound': -0.743}"
1,great offer,Cahuffman03,RocketLeagueExchange,1,-1,-1,2016-11-01,2016-11-02 03:59:23,1 key alpha boost,"{'neg': 0.0, 'neu': 0.185, 'pos': 0.815, 'compound': 0.6588}","{'neg': 0.0, 'neu': 0.526, 'pos': 0.474, 'compound': 0.4019}"
1,but it is her turn plus it is a woman president,A1cntrler,The_Donald,7,-1,-1,2016-11-01,2016-11-02 05:12:57,bill clinton appeared to be charismatic and empathetic like a televangelist preacher back in the day when people watched tv he could speak plainly to real issues of course did nothiing to solve them and only used what he learned from those suffering to siphon and translate that pain into his wallet  what really strikes me is how anyone can follow hillary  who displays neither charisma nor empathy,"{'neg': 0.0, 'neu': 1.0, 'pos': 0.0, 'compound': 0.0}","{'neg': 0.115, 'neu': 0.798, 'pos': 0.087, 'compound': -0.4927}"
1,the tables have turned stop trying to one up everyone,Ruueee,BlackPeopleTwitter,3,-1,-1,2016-11-01,2016-11-02 05:20:28,fuck you mean hoe i been to 30 and in my 20s,"{'neg': 0.196, 'neu': 0.804, 'pos': 0.0, 'compound': -0.296}","{'neg': 0.241, 'neu': 0.759, 'pos': 0.0, 'compound': -0.5423}"
1,he probably just did not want to read them because it is illegal to read them and only the news media can see them duh,Maryland_Mansion,The_Donald,1,-1,-1,2016-11-01,2016-11-02 05:48:21,i provided the dude wiki leaks and he said he does not believe them because they are trouble,"{'neg': 0.187, 'neu': 0.813, 'pos': 0.0, 'compound': -0.5889}","{'neg': 0.144, 'neu': 0.856, 'pos': 0.0, 'compound': -0.4019}"
1,we all know hanzo is super original and clearly the first japanese bow character ever,lorywindrunner,Paladins,3,-1,-1,2016-11-01,2016-11-02 06:20:40,that is the point i was implying that it is stupid that many consider cassie a clone of hanzo because they got a bow,"{'neg': 0.0, 'neu': 0.574, 'pos': 0.426, 'compound': 0.836}","{'neg': 0.139, 'neu': 0.861, 'pos': 0.0, 'compound': -0.5267}"
1,if only this could have been prevented ,RedSyringe,WTF,3,-1,-1,2016-11-01,2016-11-02 06:28:23,man voluntarily has himself set on fire instantly regrets,"{'neg': 0.29, 'neu': 0.6, 'pos': 0.11, 'compound': -0.4215}","{'neg': 0.412, 'neu': 0.588, 'pos': 0.0, 'compound': -0.5994}"
