label,comment,author,subreddit,score,ups,downs,date,created_utc,parent_comment,vader_comment,vader_pcomment
0,nc and nh,Trumpbart,politics,2,-1,-1,2016-10-01,2016-10-16 23:55:23,yeah i get that argument at this point i would prefer is she lived in nc as well,"{'neg': 0.0, 'neu': 1.0, 'pos': 0.0, 'compound': 0.0}","{'neg': 0.12, 'neu': 0.673, 'pos': 0.207, 'compound': 0.2023}"
0,you do know west teams play against west teams more than east teams right,Shbshb906,nba,-4,-1,-1,2016-11-01,2016-11-01 00:24:10,the blazers and mavericks the wests 5 and 6 seed did not even carry a good enough record to make the playoffs in the east last year,"{'neg': 0.0, 'neu': 0.844, 'pos': 0.156, 'compound': 0.34}","{'neg': 0.0, 'neu': 0.9, 'pos': 0.1, 'compound': 0.4404}"
0,they were underdogs earlier today but since gronk's announcement this afternoon the vegas line has moved to patriots 1,Creepeth,nfl,3,3,0,2016-09-01,2016-09-22 21:45:37,they are favored to win,"{'neg': 0.0, 'neu': 1.0, 'pos': 0.0, 'compound': 0.0}","{'neg': 0.0, 'neu': 0.233, 'pos': 0.767, 'compound': 0.765}"
0,this meme is not funny none of the new york nigga ones are,icebrotha,BlackPeopleTwitter,-8,-1,-1,2016-10-01,2016-10-18 21:03:47,deadass do not kill my buzz,"{'neg': 0.179, 'neu': 0.821, 'pos': 0.0, 'compound': -0.3412}","{'neg': 0.0, 'neu': 0.517, 'pos': 0.483, 'compound': 0.5773}"
0,i could use one of those tools,cush2push,MaddenUltimateTeam,6,-1,-1,2016-12-01,2016-12-30 17:00:13,yep can confirm i saw the tool they use for that it was made by our boy easports_mut,"{'neg': 0.0, 'neu': 1.0, 'pos': 0.0, 'compound': 0.0}","{'neg': 0.0, 'neu': 0.885, 'pos': 0.115, 'compound': 0.296}"
0,i do not pay attention to her but as long as she is legal i would not kick her out of bed before she took a load,only7inches,AskReddit,0,0,0,2016-09-01,2016-09-02 10:35:08,do you find ariana grande sexy ,"{'neg': 0.0, 'neu': 0.884, 'pos': 0.116, 'compound': 0.2259}","{'neg': 0.0, 'neu': 0.638, 'pos': 0.362, 'compound': 0.5267}"
0,trick or treating in general is just weird,only7inches,AskReddit,1,-1,-1,2016-10-01,2016-10-23 21:43:03,what is your weird or unsettling trick or treat story,"{'neg': 0.326, 'neu': 0.674, 'pos': 0.0, 'compound': -0.2263}","{'neg': 0.25, 'neu': 0.517, 'pos': 0.233, 'compound': 0.2023}"
0,blade masterymasamune or gtfo,P0k3rm4s7,FFBraveExvius,2,-1,-1,2016-10-01,2016-10-13 21:13:55,probably sephiroth i refuse to taint his greatness with my weak builds he should equip only the best tms,"{'neg': 0.0, 'neu': 1.0, 'pos': 0.0, 'compound': 0.0}","{'neg': 0.202, 'neu': 0.632, 'pos': 0.166, 'compound': 0.0258}"
0,you do not have to you have a good build buy games or save it,SoupToPots,pcmasterrace,1,-1,-1,2016-10-01,2016-10-27 19:11:06,what to upgrade i have 500 to spend mainly because it is my birthday on the 31st and i am not really sure what to upgrade i do not have to spend all 500 i could spend as little or all of it if i want specs are cpu i56600k cooler cm 212 evo ram 8gb corsair vengence lpx 2400mhz gpu evga gtx 1070 sc case corsair spec alpha psu evga p2 650w storage one 480 gb corsair force le monitor benq xl2411z keyboard razer blackwidow tournament edition what i am thinking of right now is get a 1tb wd blue buy another 8gb of ram replace my razer blackwidow with a keyboard with actual cherry mx switches replace my case does not really offer features for good cable management save up for a volta card,"{'neg': 0.0, 'neu': 0.663, 'pos': 0.337, 'compound': 0.7269}","{'neg': 0.016, 'neu': 0.9, 'pos': 0.085, 'compound': 0.8643}"
0,i would love to see him at lolla,chihawks,Lollapalooza,2,-1,-1,2016-11-01,2016-11-21 23:39:12,probably count kanye out since the rest of his tour is canceled it does not seem in the cards but he is also so unpredictable it could change thankfully i saw him before he started canceling shows going on long rants and showing up late but i would love to see him again especially at lolla thoughts,"{'neg': 0.0, 'neu': 0.625, 'pos': 0.375, 'compound': 0.6369}","{'neg': 0.046, 'neu': 0.804, 'pos': 0.15, 'compound': 0.8201}"
0,i think a significant amount would be against spending their tax dollars on other people,ThisIsNotKimJongUn,politics,92,92,0,2016-09-01,2016-09-20 17:53:52,i bet if that money was poured into college debt or health debt relief 81 of americans would have been for it instead,"{'neg': 0.0, 'neu': 0.886, 'pos': 0.114, 'compound': 0.2023}","{'neg': 0.178, 'neu': 0.712, 'pos': 0.11, 'compound': -0.2263}"
0,damn i was hoping god was real,Kvetch__22,baseball,14,-1,-1,2016-10-01,2016-10-28 09:07:50,james shields will not exercise optout clause,"{'neg': 0.233, 'neu': 0.345, 'pos': 0.422, 'compound': 0.296}","{'neg': 0.0, 'neu': 1.0, 'pos': 0.0, 'compound': 0.0}"
0,they have an agenda,Readbooks6,exmormon,4,-1,-1,2016-10-01,2016-10-15 01:14:03,there is no time to worry about leaks when they gays are already out to get you,"{'neg': 0.0, 'neu': 1.0, 'pos': 0.0, 'compound': 0.0}","{'neg': 0.267, 'neu': 0.733, 'pos': 0.0, 'compound': -0.6249}"
0,great idea,pieman2005,fantasyfootball,1,-1,-1,2016-10-01,2016-10-06 23:27:53,team specific threads no matter how many articles you read or how many hours of red zone you watch nothing quite makes up for watching every play of a game would the members of this communitythe mods be open to creating a sticky post that has a team individual thread for every team in the nfl where team specific conversation can take place and people that watch individual games can comment we may even be able to get some guys from team specific subreddits to stop by and give us some new insight,"{'neg': 0.0, 'neu': 0.185, 'pos': 0.815, 'compound': 0.6588}","{'neg': 0.034, 'neu': 0.919, 'pos': 0.047, 'compound': 0.3239}"
0,ayy bb wassup it makes a bit more sense in context,Jakethejoker,NYGiants,29,29,0,2016-09-01,2016-09-19 18:46:58,ill give you a hint they commented in this thread,"{'neg': 0.0, 'neu': 1.0, 'pos': 0.0, 'compound': 0.0}","{'neg': 0.237, 'neu': 0.763, 'pos': 0.0, 'compound': -0.4215}"
0,what the fuck,Pishwi,AskReddit,22,-1,-1,2016-11-01,2016-11-04 20:10:33,star wars easy i am not that bothered about indiana jones to be honest,"{'neg': 0.636, 'neu': 0.364, 'pos': 0.0, 'compound': -0.5423}","{'neg': 0.219, 'neu': 0.486, 'pos': 0.295, 'compound': 0.0675}"
0,noted,kozmo1313,NewOrleans,2,-1,-1,2016-12-01,2016-12-20 21:59:45,you are adorable,"{'neg': 0.0, 'neu': 1.0, 'pos': 0.0, 'compound': 0.0}","{'neg': 0.0, 'neu': 0.238, 'pos': 0.762, 'compound': 0.4939}"
0,because it is what really bothers him and it is a sign of weakness,kozmo1313,politics,15,-1,-1,2016-12-01,2016-12-26 20:10:45,he actually acts like a moody emo girl on twitter he lashes out over incredibly petty things and takes it out on social media he is a 70 year old man doing this grow the fuck up and think of your dignity man,"{'neg': 0.329, 'neu': 0.671, 'pos': 0.0, 'compound': -0.5984}","{'neg': 0.161, 'neu': 0.736, 'pos': 0.103, 'compound': -0.4391}"
0,why you fail me my precious,kozmo1313,HillaryForPrison,1,1,0,2016-09-01,2016-09-18 13:02:45,clinton struggles to gain traction in florida despite spending  clinton shocked money cannot buy everything,"{'neg': 0.312, 'neu': 0.357, 'pos': 0.33, 'compound': 0.0516}","{'neg': 0.226, 'neu': 0.613, 'pos': 0.16, 'compound': -0.1027}"
0,preflashpoint clark and lois,BreakingGarrick,superman,2,2,0,2016-09-01,2016-09-16 02:34:04,is that the older clark and older lois,"{'neg': 0.0, 'neu': 1.0, 'pos': 0.0, 'compound': 0.0}","{'neg': 0.0, 'neu': 1.0, 'pos': 0.0, 'compound': 0.0}"
0,she hugs him back tightly burying her head into the space between his collar bone and shoulder,EternalCanadian,WarHammer40kRP,1,-1,-1,2016-10-01,2016-10-28 15:48:21,guilt roles over mel and he hesitates for a moment before pulling the girl into a hug shhh it is okay tara you two are not going anywhere this time aurelia and i will not let that happen,"{'neg': 0.0, 'neu': 0.833, 'pos': 0.167, 'compound': 0.4939}","{'neg': 0.111, 'neu': 0.765, 'pos': 0.123, 'compound': 0.128}"
0,at this point they are so stable i could build a house out of them,DumbNameIWillRegret,vitahacks,17,-1,-1,2016-11-01,2016-11-01 15:17:28,they will never get the stability of the 3ds,"{'neg': 0.0, 'neu': 0.819, 'pos': 0.181, 'compound': 0.4341}","{'neg': 0.0, 'neu': 1.0, 'pos': 0.0, 'compound': 0.0}"
0,conservatism as an ideology is for sure a reaction to liberalism but that is not to say it has not developed into something other than that since its conception,MayorMcCheese59,politics,1,-1,-1,2016-12-01,2016-12-24 00:04:06,i still doubt that all conservatives stand for is defeating liberals if you use the election of trump as an example for the failure of modern conservatism is it also fair to use the election of hillary clinton as a representative for modern liberalism i guess not and the all conservatives stand for is defeating liberals could be applied vice versa if you only listen to people who are the loudest,"{'neg': 0.0, 'neu': 0.944, 'pos': 0.056, 'compound': 0.1655}","{'neg': 0.139, 'neu': 0.832, 'pos': 0.029, 'compound': -0.8271}"
0,maybe not control but certainly that is evidence of collusion,SunTzu-,politics,1,-1,-1,2016-10-01,2016-10-13 20:48:14,today russian media tweeted out that wikileaks had released more of podesta's emails before wikileaks even did it there is some control here,"{'neg': 0.221, 'neu': 0.779, 'pos': 0.0, 'compound': -0.3724}","{'neg': 0.0, 'neu': 1.0, 'pos': 0.0, 'compound': 0.0}"
0,mine auto renewed without asking me the other day,yeaweckin,2007scape,3,-1,-1,2016-11-01,2016-11-01 01:40:17,thank you jagex for being cool jagex has always been a cool company and we could thank them for tons of things but i just noticed that they do not charge your card as a recurring subscription so many companies today do scummy things where they try to get you to sign up for something so they can bill you monthly and hope you will forget about it but jagex only runs your subscription for as long as you purchased i know it is nothing huge but it is something i appreciate,"{'neg': 0.0, 'neu': 1.0, 'pos': 0.0, 'compound': 0.0}","{'neg': 0.048, 'neu': 0.808, 'pos': 0.143, 'compound': 0.813}"
0,466,Cogman117,Overwatch,5,-1,-1,2016-11-01,2016-11-03 00:20:04,467 a lovely way,"{'neg': 0.0, 'neu': 1.0, 'pos': 0.0, 'compound': 0.0}","{'neg': 0.0, 'neu': 0.423, 'pos': 0.577, 'compound': 0.6239}"
0,jesus is a fnaf fan confirmed,SuperArthurBros,fivenightsatfreddys,2,-1,-1,2016-12-01,2016-12-25 14:40:14,jesus got,"{'neg': 0.0, 'neu': 0.685, 'pos': 0.315, 'compound': 0.3182}","{'neg': 0.0, 'neu': 1.0, 'pos': 0.0, 'compound': 0.0}"
0,this would make me cry,neutralneutrals,AskReddit,1,-1,-1,2016-11-01,2016-11-07 12:03:16,you are like the end piece of bread in a loaf everyone touches you but no one wants you,"{'neg': 0.437, 'neu': 0.563, 'pos': 0.0, 'compound': -0.4767}","{'neg': 0.13, 'neu': 0.789, 'pos': 0.081, 'compound': -0.2617}"
0,at first i thought it was instructions on fixing a car it was not,Soperos,WTF,1,-1,-1,2016-10-01,2016-10-30 19:52:04,found this under a box of porno mags well cleaning out a trailer,"{'neg': 0.0, 'neu': 1.0, 'pos': 0.0, 'compound': 0.0}","{'neg': 0.0, 'neu': 0.851, 'pos': 0.149, 'compound': 0.2732}"
0,this guy there is no way he is not trolling right,knezovich,RocketLeagueExchange,1,-1,-1,2016-11-01,2016-11-06 03:39:29,who,"{'neg': 0.216, 'neu': 0.784, 'pos': 0.0, 'compound': -0.296}","{'neg': 0.0, 'neu': 1.0, 'pos': 0.0, 'compound': 0.0}"
0,new,KingAetherrr,ClashRoyale,3,-1,-1,2016-11-01,2016-11-15 04:42:47,but what format,"{'neg': 0.0, 'neu': 1.0, 'pos': 0.0, 'compound': 0.0}","{'neg': 0.0, 'neu': 1.0, 'pos': 0.0, 'compound': 0.0}"
0,because they are not real human beings with actual feelings according to the videos put together by the gb,AnniePostate,exjw,7,7,0,2016-09-01,2016-09-27 02:22:00,pro tip  fool around with worldy girls,"{'neg': 0.0, 'neu': 1.0, 'pos': 0.0, 'compound': 0.0}","{'neg': 0.293, 'neu': 0.707, 'pos': 0.0, 'compound': -0.4404}"
0,side of a bullet is fucking great,QueequegTheater,RWBY,1,-1,-1,2016-10-01,2016-10-21 14:48:10,is confused why so many people dislike nickelback not that i am a fan but i am going to the music is decent enough,"{'neg': 0.0, 'neu': 0.577, 'pos': 0.423, 'compound': 0.659}","{'neg': 0.161, 'neu': 0.765, 'pos': 0.074, 'compound': -0.2339}"
1,but they will have all those reviews,RoguishPoppet,ProductTesting,0,-1,-1,2016-11-01,2016-11-01 02:04:59,the dumb thing is they are risking their seller account too,"{'neg': 0.0, 'neu': 1.0, 'pos': 0.0, 'compound': 0.0}","{'neg': 0.384, 'neu': 0.616, 'pos': 0.0, 'compound': -0.6808}"
0,kiiiiiiiil me,DietrichDoesDamage,letsgofish,2,2,0,2016-09-01,2016-09-05 00:00:35,pgt 94 vs indians all rants and angry posts go here i will start fuck fernando rodney,"{'neg': 0.0, 'neu': 1.0, 'pos': 0.0, 'compound': 0.0}","{'neg': 0.412, 'neu': 0.588, 'pos': 0.0, 'compound': -0.8442}"
0,rfuckyouididthemath,xVamplify,videos,3,-1,-1,2016-12-01,2016-12-31 16:37:40,this is a great response too bad about the lack of accolades,"{'neg': 0.0, 'neu': 1.0, 'pos': 0.0, 'compound': 0.0}","{'neg': 0.317, 'neu': 0.469, 'pos': 0.214, 'compound': -0.2481}"
0,even about that round of golf,drunk98,CrazyIdeas,1,-1,-1,2016-10-01,2016-10-08 09:09:32,north korea has never lied not once,"{'neg': 0.0, 'neu': 1.0, 'pos': 0.0, 'compound': 0.0}","{'neg': 0.0, 'neu': 0.733, 'pos': 0.267, 'compound': 0.2924}"
0,my stuffed animal i have had since i was born,kn1820,AskReddit,1,-1,-1,2016-10-01,2016-10-11 11:17:42,your house is burning down and you only have time to grab one thing  not including family or pets  what do you grab,"{'neg': 0.0, 'neu': 1.0, 'pos': 0.0, 'compound': 0.0}","{'neg': 0.0, 'neu': 1.0, 'pos': 0.0, 'compound': 0.0}"
0,i only watched the first 20 mins because i fell asleep but in that time he already had drank a coke zero and had opened a diet mountain dew,LemonLimeAlltheTime,Games,1,-1,-1,2016-10-01,2016-10-05 23:08:46,poor dan he looks like he needs some coffee or a energy drink i do not think i have ever seen him be this quiet during a live stream,"{'neg': 0.0, 'neu': 1.0, 'pos': 0.0, 'compound': 0.0}","{'neg': 0.098, 'neu': 0.757, 'pos': 0.145, 'compound': 0.128}"
0,lube up and take it,lilschlicker,nfl,0,-1,-1,2016-11-01,2016-11-01 02:31:45,this season's nfc equivalent of the browns is straight up butt fucking us i do not know how to handle this,"{'neg': 0.0, 'neu': 1.0, 'pos': 0.0, 'compound': 0.0}","{'neg': 0.182, 'neu': 0.74, 'pos': 0.078, 'compound': -0.5473}"
0,funny how the media chose to never bring it up this election,MustangMark83,The_Donald,11,-1,-1,2016-12-01,2016-12-27 23:41:25,umm yes it was a huge scandal do you not member,"{'neg': 0.0, 'neu': 0.791, 'pos': 0.209, 'compound': 0.4404}","{'neg': 0.179, 'neu': 0.494, 'pos': 0.327, 'compound': 0.3382}"
0,cannot go wrong with yahudi and dap soros as well,jwrx,malaysia,5,-1,-1,2016-11-01,2016-11-01 02:34:24,hey do not you know that a convoluted unsupported theory which is only proven by a reddit comment is a definite fact i mean how can a simple explanation make more sense clearly the tinfoil hat explanation always make more sense always,"{'neg': 0.0, 'neu': 0.632, 'pos': 0.368, 'compound': 0.5653}","{'neg': 0.059, 'neu': 0.83, 'pos': 0.111, 'compound': 0.3353}"
0,1571049,RandomRedditorWithNo,counting,1,-1,-1,2016-12-01,2016-12-17 06:56:28,1571048,"{'neg': 0.0, 'neu': 1.0, 'pos': 0.0, 'compound': 0.0}","{'neg': 0.0, 'neu': 1.0, 'pos': 0.0, 'compound': 0.0}"
0,roger is such a good owner,I_give_rimjob_4_free,leagueoflegends,0,-1,-1,2016-11-01,2016-11-06 17:16:25,but i liked xpascal better with tartle then with chowex,"{'neg': 0.0, 'neu': 0.633, 'pos': 0.367, 'compound': 0.4404}","{'neg': 0.0, 'neu': 0.514, 'pos': 0.486, 'compound': 0.8201}"
1,wow it is totally unreasonable to assume that the agency that covered up bush war crimes because muh republican party would be partisan as fuck,pb2crazy,politics,2,-1,-1,2016-11-01,2016-11-01 02:42:11,clinton campaign accuses fbi of 'blatant double standard',"{'neg': 0.212, 'neu': 0.602, 'pos': 0.186, 'compound': -0.2263}","{'neg': 0.255, 'neu': 0.745, 'pos': 0.0, 'compound': -0.34}"
1,ho ho ho but melania said that there is no way it could have happened because she did not know the woman,pb2crazy,politics,8,-1,-1,2016-10-01,2016-10-18 16:20:53,anyone else think that it was interesting the way she mentioned that she had a tape recorder in her hand while he was assaulting her,"{'neg': 0.134, 'neu': 0.866, 'pos': 0.0, 'compound': -0.4753}","{'neg': 0.106, 'neu': 0.705, 'pos': 0.189, 'compound': 0.3818}"
0,to be honest that giant dent was probably made by the glacier itself,doihavemakeanewword,MapPorn,5,-1,-1,2016-10-01,2016-10-22 18:22:36,this map makes it look like there is a giant lush fertile valley in the middle just waiting to produce all the food the world could possibly eat instead of being the endless fucking wasteland of ice and tundra that stored captain america for 65 years,"{'neg': 0.0, 'neu': 1.0, 'pos': 0.0, 'compound': 0.0}","{'neg': 0.0, 'neu': 0.946, 'pos': 0.054, 'compound': 0.3612}"
0,how i am considered an asshole because i let people know that most of the shit they do or have is because of a trend that will die out in a month,Durts,AskReddit,1,-1,-1,2016-12-01,2016-12-08 03:48:17,what do you hate the most about the mainstream,"{'neg': 0.109, 'neu': 0.78, 'pos': 0.111, 'compound': 0.0258}","{'neg': 0.316, 'neu': 0.684, 'pos': 0.0, 'compound': -0.5719}"
0,try talking to the department head,Dropdat87,minnesotavikings,1,-1,-1,2016-11-01,2016-11-06 20:18:17,random question how much of a pain in the ass is the appeals process for grades in college i have a teacher who will not give me my credit for the online homework because of an obvious technical glitch,"{'neg': 0.0, 'neu': 1.0, 'pos': 0.0, 'compound': 0.0}","{'neg': 0.153, 'neu': 0.788, 'pos': 0.059, 'compound': -0.6369}"
0,run run pass punt,ColdCaulkCraig,nfl,6,-1,-1,2016-12-01,2016-12-20 01:22:39,doug marrone named jaguars interim head coach,"{'neg': 0.0, 'neu': 1.0, 'pos': 0.0, 'compound': 0.0}","{'neg': 0.0, 'neu': 1.0, 'pos': 0.0, 'compound': 0.0}"
0,2 cc3  2 cc2s for loopers,DonAtari,RocketLeagueExchange,1,-1,-1,2016-10-01,2016-10-20 01:21:34,dominus gt 4 takumi rxt 3 trinity 1 loopers 2 lime loopers 15 more inside keys takumi anubis 05 keys breakout snakeskin 05 keys 2x cc2 025 keys each polygonal boost 05 keys 5 rare decals 1 key black witch hat 1 key white wich hat 1 key also taking offers for the lime loopers,"{'neg': 0.0, 'neu': 1.0, 'pos': 0.0, 'compound': 0.0}","{'neg': 0.042, 'neu': 0.866, 'pos': 0.092, 'compound': 0.4648}"
0,aftermarket mods though,Baryn,starcitizen,1,-1,-1,2016-11-01,2016-11-27 09:34:21,you are hoping for a lot it is a purpose built hardcore industrial monster that thing will pretty much glow in the dark on sensors,"{'neg': 0.0, 'neu': 1.0, 'pos': 0.0, 'compound': 0.0}","{'neg': 0.0, 'neu': 0.778, 'pos': 0.222, 'compound': 0.7184}"
0,for me it is suce success that give me the most trouble,spiritcrusher77,AskReddit,1,-1,-1,2016-10-01,2016-10-12 21:50:06,how to spell ness necc nessecary even my auto correct is used to me spelling it wrong,"{'neg': 0.191, 'neu': 0.574, 'pos': 0.236, 'compound': 0.1796}","{'neg': 0.162, 'neu': 0.838, 'pos': 0.0, 'compound': -0.4767}"
0,is it worth it to go for mushroom stews,rafikiknowsdeway1,LetItDie,1,-1,-1,2016-12-01,2016-12-24 02:03:56,since mushroom stew costs 50k and your initial kc cap is 40k i would say no the only way to increase the kc limit is through the tdm menu and you are going to want to buy some mushroom stew before too long,"{'neg': 0.0, 'neu': 0.808, 'pos': 0.192, 'compound': 0.2263}","{'neg': 0.0, 'neu': 0.913, 'pos': 0.087, 'compound': 0.3818}"
0,yes but each battle 10 3112 snorlax will last more than a minute,LikeAnAbsir,pokemongo,1,-1,-1,2016-10-01,2016-10-17 17:21:50,you do know that the timer resets for each battle right,"{'neg': 0.209, 'neu': 0.677, 'pos': 0.114, 'compound': -0.3716}","{'neg': 0.206, 'neu': 0.794, 'pos': 0.0, 'compound': -0.3818}"
0,i believe you can buy just the happy meal toys for 199 each,phenomworks,pokemon,2,-1,-1,2016-10-01,2016-10-19 19:47:49,me that will be 5 happy meals for my fat kid,"{'neg': 0.0, 'neu': 0.764, 'pos': 0.236, 'compound': 0.5719}","{'neg': 0.0, 'neu': 0.709, 'pos': 0.291, 'compound': 0.5719}"
0,found the steins gate fan,Miguelinileugim,AdviceAnimals,2,-1,-1,2016-10-01,2016-10-01 21:10:07,honestly this reminds me of stein'sgate,"{'neg': 0.0, 'neu': 0.635, 'pos': 0.365, 'compound': 0.3182}","{'neg': 0.0, 'neu': 0.625, 'pos': 0.375, 'compound': 0.4588}"
0,if you are buying something at only 20 off you dun goofed,clive_bigsby,frugalmalefashion,2,-1,-1,2016-10-01,2016-10-10 23:16:17,i think you could make a bot that randomly posts gaponbr 2040 sales every day here and chances are it would be right,"{'neg': 0.0, 'neu': 1.0, 'pos': 0.0, 'compound': 0.0}","{'neg': 0.0, 'neu': 0.921, 'pos': 0.079, 'compound': 0.2023}"
0,why would anyone ever think she talks shit about young people in private,VegaThePunisher,progressive,2,-1,-1,2016-10-01,2016-10-01 15:52:15,she is speaking to the donor class and asks for understanding for the experiences of young people hurt by the recession and we already knew she was the centrist and in turn the center is hopefully moving leftward everything she says here sounds reasonable to good to me,"{'neg': 0.231, 'neu': 0.769, 'pos': 0.0, 'compound': -0.5574}","{'neg': 0.113, 'neu': 0.785, 'pos': 0.102, 'compound': -0.1531}"
0,john lott is a hack an the only people who give him credence are those that want to keep any safety regulations away from guns,apolitic,politics,1,-1,-1,2016-11-01,2016-11-01 03:08:31,john lott cdc 'coding error' hid record low for accidental gun deaths  breitbart,"{'neg': 0.0, 'neu': 0.849, 'pos': 0.151, 'compound': 0.4767}","{'neg': 0.524, 'neu': 0.476, 'pos': 0.0, 'compound': -0.7845}"
0,i believe forevs playing offlane,VoRicebowl,DotA2,1,-1,-1,2016-11-01,2016-11-16 01:31:05,only thing  forev is playing carry not offlane febby back to support velo is still on the playing squad so he will be offlane,"{'neg': 0.0, 'neu': 0.69, 'pos': 0.31, 'compound': 0.2023}","{'neg': 0.0, 'neu': 0.769, 'pos': 0.231, 'compound': 0.6486}"
0,while i am no fan of bo1s and i hate tournaments without winner and loser bracket as the second best team may very well end up 58th this is not the reason why a team should fail a groupstage,ep1939,leagueoflegends,2,-1,-1,2016-10-01,2016-10-03 19:08:54,1 they got fucked by riot best of 2 format so the have less games 2 they cannot afford the support staff because they do not have sponsors 3 in my opinion the best of 1 group format also plays a big role look at what a shitfest this whole worlds is so far with everyone beating everyone eu actually looked pretty good in most of their games they just do not know how to finishthey throw a lot,"{'neg': 0.237, 'neu': 0.581, 'pos': 0.182, 'compound': -0.4339}","{'neg': 0.136, 'neu': 0.696, 'pos': 0.169, 'compound': 0.501}"
0,that fan is backwards,ThatUndeadLegacy,pcmasterrace,1,-1,-1,2016-10-01,2016-10-02 02:52:03,popular youtuber demolitionranch joins the masterrace,"{'neg': 0.0, 'neu': 0.566, 'pos': 0.434, 'compound': 0.3182}","{'neg': 0.0, 'neu': 0.641, 'pos': 0.359, 'compound': 0.4215}"
0,should have been a lunatic you get to build a pyramid for your cat,Mr_jon3s,CrusaderKings,1,1,0,2016-09-01,2016-09-16 21:05:07,by far the saddest event i have recieved,"{'neg': 0.198, 'neu': 0.802, 'pos': 0.0, 'compound': -0.4939}","{'neg': 0.4, 'neu': 0.6, 'pos': 0.0, 'compound': -0.6124}"
0,most wow players are peasants so that is not really a good argument here and calling stealing a reference is scummy as fuck referencing includes changing it to the point were its recognizable but still has its own uniqueness like dark souls references berserk without directly putting in guts,LunaticMode,dotamasterrace,1,-1,-1,2016-11-01,2016-11-10 04:47:11,referencing something is not bad in any way most wow players myself included found it funny,"{'neg': 0.148, 'neu': 0.749, 'pos': 0.103, 'compound': -0.1259}","{'neg': 0.0, 'neu': 0.569, 'pos': 0.431, 'compound': 0.8703}"
