label,comment,author,subreddit,score,ups,downs,date,created_utc,parent_comment,vader_comment,vader_pcomment
0,nobody cares trump won go spam some other sub with this bs,ozric101,The_Donald,3,-1,-1,2016-11-01,2016-11-23 22:36:00,huma abedin's sister tells supporters on fb to call the doj to audit the vote today clinton team met about this and now jill stein is raising money to file for recount in wimi and pa hillary is behind this 100 you also saw hillary staging pictures of her going outside to walk her dog or to the bookstore michigan has still not been called maybe i am just crazy but it looks like hillary has not given up yet behind the scenes,"{'neg': 0.137, 'neu': 0.495, 'pos': 0.368, 'compound': 0.6369}","{'neg': 0.019, 'neu': 0.918, 'pos': 0.063, 'compound': 0.5848}"
0,thanks dude,timebomb011,NHLHUT,1,-1,-1,2016-11-01,2016-11-05 00:05:46,nice set man pretty funny,"{'neg': 0.0, 'neu': 0.239, 'pos': 0.761, 'compound': 0.4926}","{'neg': 0.0, 'neu': 0.183, 'pos': 0.817, 'compound': 0.836}"
0,why would i want to downgrade,KingJak117,AskReddit,1,-1,-1,2016-10-01,2016-10-23 15:10:25,a lot of the world's problems could be remedied if everyone lived in another country for a year,"{'neg': 0.0, 'neu': 0.794, 'pos': 0.206, 'compound': 0.0772}","{'neg': 0.137, 'neu': 0.863, 'pos': 0.0, 'compound': -0.4019}"
0,wtf i thought that mcd's wrote that song,pm_me_ur_shits_gurl,AskReddit,2,-1,-1,2016-10-01,2016-10-06 19:42:12,justin timberlake's 'i am loving it' will always remind me of mcdonald's i am not a fan of the song in the first place but mcdonald's pretty much hijacked it and made it their own i do not even think he sings it anymore and i seem to remember that they stopped playing it on the radio after a very short time of it being released,"{'neg': 0.352, 'neu': 0.648, 'pos': 0.0, 'compound': -0.5859}","{'neg': 0.054, 'neu': 0.819, 'pos': 0.126, 'compound': 0.7285}"
0,arcade models scott cawthon yinyanggio1987 arcade screen glitchedpie,WilliamAfton,fivenightsatfreddys,1,-1,-1,2016-10-01,2016-10-18 21:05:08,arcade machine texturing and modeling test,"{'neg': 0.0, 'neu': 1.0, 'pos': 0.0, 'compound': 0.0}","{'neg': 0.0, 'neu': 1.0, 'pos': 0.0, 'compound': 0.0}"
1,how about marcos rojo,Khapsee,soccer,2,-1,-1,2016-11-01,2016-11-01 14:37:26,daniel passarella on messi he should not captain argentina i admire messi but i think his personality and his way of being is withdrawn and timidthey already have a great leader  ramiro funes mori he should be captain,"{'neg': 0.0, 'neu': 1.0, 'pos': 0.0, 'compound': 0.0}","{'neg': 0.0, 'neu': 0.828, 'pos': 0.172, 'compound': 0.8271}"
0,on your computer,goonsack,The_Donald,3,-1,-1,2016-10-01,2016-10-21 04:22:11,those are blue pills though,"{'neg': 0.0, 'neu': 1.0, 'pos': 0.0, 'compound': 0.0}","{'neg': 0.0, 'neu': 1.0, 'pos': 0.0, 'compound': 0.0}"
0,the sense of humour is basically the same that is what gets me,Crushnaut,videos,3,-1,-1,2016-12-01,2016-12-23 03:22:46,what if he had changed his tone,"{'neg': 0.0, 'neu': 0.78, 'pos': 0.22, 'compound': 0.4767}","{'neg': 0.0, 'neu': 1.0, 'pos': 0.0, 'compound': 0.0}"
0,there is probably some kind of national archive that you could use,harlesslee,interestingasfuck,1,1,0,2016-09-01,2016-09-19 09:34:41,does anyone know of a repository for historical correspondence i am looking for something with a lot of content,"{'neg': 0.0, 'neu': 1.0, 'pos': 0.0, 'compound': 0.0}","{'neg': 0.0, 'neu': 1.0, 'pos': 0.0, 'compound': 0.0}"
1,no galio stacks magic resistance but ryze deals mana damage,Mantasada,leagueoflegends,1,-1,-1,2016-11-01,2016-11-01 14:39:54,does not galio hard counter ryze,"{'neg': 0.323, 'neu': 0.677, 'pos': 0.0, 'compound': -0.6486}","{'neg': 0.0, 'neu': 0.755, 'pos': 0.245, 'compound': 0.0762}"
0,they made a new one now,cowboysfan88,nfl,1,-1,-1,2016-12-01,2016-12-06 17:58:30,i like the one with any way you want it because that is a good song and the black girl is fine af,"{'neg': 0.0, 'neu': 1.0, 'pos': 0.0, 'compound': 0.0}","{'neg': 0.0, 'neu': 0.679, 'pos': 0.321, 'compound': 0.7579}"
0,its on one of the highlights because we threw a td that play,BisonST,nfl,6,-1,-1,2016-11-01,2016-11-22 05:17:00,i saw a paper airplane fly across the screen not sure if it made it to the field but you know that is where they wanted it to go,"{'neg': 0.0, 'neu': 0.833, 'pos': 0.167, 'compound': 0.34}","{'neg': 0.052, 'neu': 0.948, 'pos': 0.0, 'compound': -0.1232}"
0,they probably are i just always forget to use them,christo334,gaming,1,1,0,2016-09-01,2016-09-25 08:17:39,you you stop that you stop that right now melee build and plasmids is the most fun ever,"{'neg': 0.174, 'neu': 0.826, 'pos': 0.0, 'compound': -0.2263}","{'neg': 0.191, 'neu': 0.652, 'pos': 0.156, 'compound': 0.0498}"
0,there is no way you could eat that many this calls for a contest,veriix,videos,2,-1,-1,2016-10-01,2016-10-17 18:48:05,huh that is not that much actually it would suck but i definitely think i could eat 200 apple seeds in a sitting,"{'neg': 0.172, 'neu': 0.828, 'pos': 0.0, 'compound': -0.3595}","{'neg': 0.076, 'neu': 0.784, 'pos': 0.139, 'compound': 0.3818}"
0,oh man oh man i do not know what is going on,_AlreadyTaken_,mildlyinteresting,30,-1,-1,2016-12-01,2016-12-09 18:54:33,hey you want to get highhh,"{'neg': 0.0, 'neu': 1.0, 'pos': 0.0, 'compound': 0.0}","{'neg': 0.0, 'neu': 1.0, 'pos': 0.0, 'compound': 0.0}"
0,what happened at the show,akimbocorndogs,gamegrumps,4,-1,-1,2016-10-01,2016-10-09 20:16:03,this about sums up the long island show,"{'neg': 0.0, 'neu': 1.0, 'pos': 0.0, 'compound': 0.0}","{'neg': 0.0, 'neu': 1.0, 'pos': 0.0, 'compound': 0.0}"
0,are they actually beating them though,reptile7383,politics,1,-1,-1,2016-10-01,2016-10-05 14:53:47,beating the democrats at their own game love it,"{'neg': 0.375, 'neu': 0.625, 'pos': 0.0, 'compound': -0.4588}","{'neg': 0.207, 'neu': 0.483, 'pos': 0.31, 'compound': 0.3595}"
0,you can put your weed in there,k0mbine,StarWars,0,-1,-1,2016-11-01,2016-11-07 13:12:00,watermelon death star carved by my dad,"{'neg': 0.0, 'neu': 1.0, 'pos': 0.0, 'compound': 0.0}","{'neg': 0.411, 'neu': 0.589, 'pos': 0.0, 'compound': -0.636}"
0,i removed like 2 links between the 2 for comedic effect one was the hot page of the sub,JeliLiam,fivenightsatfreddys,1,-1,-1,2016-12-01,2016-12-04 12:16:36,wait but how does it not show that you accessed the front page of the reddit did you go through a link sent to you for this post,"{'neg': 0.0, 'neu': 0.766, 'pos': 0.234, 'compound': 0.6369}","{'neg': 0.0, 'neu': 1.0, 'pos': 0.0, 'compound': 0.0}"
0,i just unlocked the full tempest traitline and cannot believe it is not unanimously agreed that overloading air is the single greatest spell in the game,DragonballFan1,Guildwars2,1,-1,-1,2016-11-01,2016-11-01 15:01:26,ele main never switched tempest off since i unlocked it,"{'neg': 0.063, 'neu': 0.793, 'pos': 0.145, 'compound': 0.5245}","{'neg': 0.0, 'neu': 1.0, 'pos': 0.0, 'compound': 0.0}"
0,the apprentice,BeCarefulNow,JusticeServed,3,-1,-1,2016-10-01,2016-10-28 11:20:46,why does trump even have a star i had no idea,"{'neg': 0.0, 'neu': 1.0, 'pos': 0.0, 'compound': 0.0}","{'neg': 0.18, 'neu': 0.82, 'pos': 0.0, 'compound': -0.296}"
0,you must deliver on this,shenrectibgly,The_Donald,1,-1,-1,2016-11-01,2016-11-01 15:02:20,if it is danney dna i will eat nothing but chicken tendies until election day,"{'neg': 0.0, 'neu': 1.0, 'pos': 0.0, 'compound': 0.0}","{'neg': 0.0, 'neu': 1.0, 'pos': 0.0, 'compound': 0.0}"
0,i liked it for the first half,K_multiplied-by_K,nfl,2,2,0,2016-09-01,2016-09-01 14:53:40,i remember 2011 all too well i am not going to think that again,"{'neg': 0.0, 'neu': 0.682, 'pos': 0.318, 'compound': 0.4215}","{'neg': 0.0, 'neu': 0.851, 'pos': 0.149, 'compound': 0.2732}"
0,and christie will be in charge of all mcdonald's runs until his prison sentence begins,berniebrah,EnoughTrumpSpam,6,-1,-1,2016-11-01,2016-11-07 17:06:26,gingrich giuliani priebus eyed for top jobs in trump white house sources lt if you were not scared already you better vote,"{'neg': 0.187, 'neu': 0.739, 'pos': 0.074, 'compound': -0.4588}","{'neg': 0.0, 'neu': 0.697, 'pos': 0.303, 'compound': 0.7807}"
0,plenty of people win the lottery every year and do not accomplish shit,gregzillaf,unpopularopinion,2,-1,-1,2016-12-01,2016-12-02 02:35:56,you will give him credit lol i think the place that it is due is his bank account you can accomplish amazing things when you inherit millions of dollars,"{'neg': 0.129, 'neu': 0.498, 'pos': 0.372, 'compound': 0.6588}","{'neg': 0.0, 'neu': 0.657, 'pos': 0.343, 'compound': 0.9001}"
0,well i have yet to play p5 but p4 made me reconsider how i view both myself and others so there is that,Darknesspork,Persona5,3,-1,-1,2016-11-01,2016-11-09 07:47:51,has persona 5 made anyone change their way of thinking i mean i know it is a game and all but atlus specifically focuses on the making the persona games leave an impact on the player i for one can say that after a full 120 hour playthrough of the game i feel a lot different than when i first loaded up the game the game really made me realize how much people will want to take advantage of you and use you any chance they get but that by believing in yourself and in those you trust you can reject what is thought of as normal or right and do what you believe in even though some may think that what you do is abnormal or unusual what matters the most is that you have confidence in yourself and in what you are doing i have really gained a lot of selfconfidence after playing this amazing game as well as become more aware of the things i feel are wrong in society around me i know it is rather unusual but does anyone else feel a similar way,"{'neg': 0.0, 'neu': 0.86, 'pos': 0.14, 'compound': 0.3071}","{'neg': 0.042, 'neu': 0.809, 'pos': 0.149, 'compound': 0.9712}"
0,a horny harambe,StackOfChips25,india,6,-1,-1,2016-11-01,2016-11-14 07:13:25,what is ahh,"{'neg': 0.0, 'neu': 1.0, 'pos': 0.0, 'compound': 0.0}","{'neg': 0.0, 'neu': 1.0, 'pos': 0.0, 'compound': 0.0}"
0,one of the older nits,StackOfChips25,india,16,-1,-1,2016-12-01,2016-12-23 16:47:53,which college would that be they teach you soldering in first semester in b tech,"{'neg': 0.0, 'neu': 1.0, 'pos': 0.0, 'compound': 0.0}","{'neg': 0.0, 'neu': 1.0, 'pos': 0.0, 'compound': 0.0}"
0,i guess its to avoid copyright stuff,seamushoo4,LiverpoolFC,4,-1,-1,2016-12-01,2016-12-28 13:13:29,those cuts in the video are annoying af,"{'neg': 0.268, 'neu': 0.732, 'pos': 0.0, 'compound': -0.296}","{'neg': 0.464, 'neu': 0.536, 'pos': 0.0, 'compound': -0.636}"
0,idiots all around are judging your partriotism based on which movie you picked to watch this fridayshit is getting crazier,2plus2equalsto5,india,1,-1,-1,2016-10-01,2016-10-29 08:56:41,huh,"{'neg': 0.055, 'neu': 0.945, 'pos': 0.0, 'compound': -0.0258}","{'neg': 0.0, 'neu': 1.0, 'pos': 0.0, 'compound': 0.0}"
0,i do not even know what this is,scaper28,2007scape,4,-1,-1,2016-10-01,2016-10-14 09:50:48,we have made our way on to rwhiteknighting,"{'neg': 0.0, 'neu': 1.0, 'pos': 0.0, 'compound': 0.0}","{'neg': 0.0, 'neu': 1.0, 'pos': 0.0, 'compound': 0.0}"
0,allahu akbar  god,biggoof,WTF,1,-1,-1,2016-11-01,2016-11-29 20:41:19,people standing near a truck leaking gasoline,"{'neg': 0.0, 'neu': 0.588, 'pos': 0.412, 'compound': 0.2732}","{'neg': 0.0, 'neu': 1.0, 'pos': 0.0, 'compound': 0.0}"
0,freshman year chem physics calc sophomore year boolean logic junior year boolean logic again  a shitload of labs senior year argue about notation,lrrlrr,AskReddit,2,-1,-1,2016-11-01,2016-11-15 05:31:41,electrical engineering what exactly do you do,"{'neg': 0.094, 'neu': 0.906, 'pos': 0.0, 'compound': -0.34}","{'neg': 0.0, 'neu': 1.0, 'pos': 0.0, 'compound': 0.0}"
0,one must be on drugs to catch someone on drugs,DoublePisters,todayilearned,62,-1,-1,2016-11-01,2016-11-25 18:49:14,til a drug testing expert was high on cocaine almost every day she went to work calling into question some 30000 criminal drug cases she processed over the course of eight years,"{'neg': 0.0, 'neu': 1.0, 'pos': 0.0, 'compound': 0.0}","{'neg': 0.099, 'neu': 0.901, 'pos': 0.0, 'compound': -0.5267}"
0,rekt,DoublePisters,nfl,2,-1,-1,2016-12-01,2016-12-13 02:37:47,do not think the jags understand change when they go 511 every year,"{'neg': 0.0, 'neu': 1.0, 'pos': 0.0, 'compound': 0.0}","{'neg': 0.0, 'neu': 1.0, 'pos': 0.0, 'compound': 0.0}"
0,i think this guy blows fat clouds,DoublePisters,AskReddit,1,1,0,2016-09-01,2016-09-12 17:09:00,i used to for the nicotine nicotine is awesome cigarettes are awful so now i vape i mix my own 50mg or so unflavored juice and i am in nicotine heaven,"{'neg': 0.0, 'neu': 1.0, 'pos': 0.0, 'compound': 0.0}","{'neg': 0.08, 'neu': 0.722, 'pos': 0.198, 'compound': 0.6597}"
1,language cap such a hypocrite,gusefalito,WritingPrompts,5,-1,-1,2016-11-01,2016-11-01 15:18:34,jesus christ stop getting scarlet witch drunk cap yells from across the room jesus looks up what are you talking about man it is only water only water my ass cap retorts and where the fuck did the 10000 fish in my room come from the smell is never going to come out of my suit you are harshing my vibes man jesus looked unphased do not make me call my dad he said i could be anything i wanted and i wanted to be an avenger you cannot change that cap grumbled to himself fine jesus you lead the avengers i quit he dials a quick number on his phone hey bruce yeah it is uh cap uh huh yeah well i know you have a super team too so i was wondering if maybe    what is that oh well um you just let me know everything ok dude jesus asks yeah well it looks like tony got to bruce before i did luckily i have an in with the nypd two weeks later jesus is bringing a perp into the station when he sees a familiar man mopping blood off the floor cap the man does not look up and jesus goes on his way bastard walked right where i just mopped what a piece of shit,"{'neg': 0.0, 'neu': 1.0, 'pos': 0.0, 'compound': 0.0}","{'neg': 0.086, 'neu': 0.793, 'pos': 0.121, 'compound': 0.703}"
0,sure where to,Guinness2702,AskReddit,1,-1,-1,2016-11-01,2016-11-18 17:38:38,want to go out sometime,"{'neg': 0.0, 'neu': 0.465, 'pos': 0.535, 'compound': 0.3182}","{'neg': 0.0, 'neu': 1.0, 'pos': 0.0, 'compound': 0.0}"
0,that editing gave me cancer,Steven_Seboom-boom,JusticeServed,1,-1,-1,2016-12-01,2016-12-22 17:01:40,kung fu trucker gets his revenge on phone thief,"{'neg': 0.524, 'neu': 0.476, 'pos': 0.0, 'compound': -0.6597}","{'neg': 0.657, 'neu': 0.343, 'pos': 0.0, 'compound': -0.91}"
0,for the people taking this comment seriously the hollywood star was the 7th,WiFilip,AskReddit,26,-1,-1,2016-10-01,2016-10-27 22:43:55,but what about 7 i must know,"{'neg': 0.124, 'neu': 0.876, 'pos': 0.0, 'compound': -0.1779}","{'neg': 0.0, 'neu': 1.0, 'pos': 0.0, 'compound': 0.0}"
0,isaiah thomas over boogie,radpandaparty,nba,3,-1,-1,2016-11-01,2016-11-03 20:09:07,every single active nba player ranked november 3 2016 will be updated weekly,"{'neg': 0.0, 'neu': 1.0, 'pos': 0.0, 'compound': 0.0}","{'neg': 0.0, 'neu': 0.816, 'pos': 0.184, 'compound': 0.4019}"
0,nicklas bendtner,SManSte,Gunners,1,1,0,2016-09-01,2016-09-20 11:02:46,i have looked it up and the correct spelling is 'pascal cygan',"{'neg': 0.0, 'neu': 1.0, 'pos': 0.0, 'compound': 0.0}","{'neg': 0.0, 'neu': 1.0, 'pos': 0.0, 'compound': 0.0}"
0,do you like gladiator movies,Scruffmygruff,politics,3,-1,-1,2016-10-01,2016-10-08 22:56:31,so was hastert oh wait,"{'neg': 0.0, 'neu': 0.615, 'pos': 0.385, 'compound': 0.3612}","{'neg': 0.0, 'neu': 1.0, 'pos': 0.0, 'compound': 0.0}"
0,thank you for your service,SquanchingOnPao,funny,3,-1,-1,2016-11-01,2016-11-29 16:19:41,people regularly ask why it takes so many cops to arrest a person thing is to restrain somebody safely to minimise the risk of them twisting and breaking something it takes a few people it takes numbers to prevent idiots trying to get in on the incident despite having no involvement professional agitators nosy people pranksters trying to get involved on film for youtube hits and those that just hate the police looking to take advantage of a situation whether that be to give a few kicks or put the windows through of the police vehicle source cop,"{'neg': 0.0, 'neu': 0.615, 'pos': 0.385, 'compound': 0.3612}","{'neg': 0.103, 'neu': 0.822, 'pos': 0.075, 'compound': -0.6264}"
0,and we would argue about which kind of barbecue to give you,RoboNinjaPirate,AskReddit,1,-1,-1,2016-10-01,2016-10-12 08:28:23,north carolina will give you a smoked pork bbq sandwich and the keys to a v8,"{'neg': 0.179, 'neu': 0.821, 'pos': 0.0, 'compound': -0.34}","{'neg': 0.0, 'neu': 1.0, 'pos': 0.0, 'compound': 0.0}"
0,free weekend happened,Playmis,BattleRite,1,-1,-1,2016-12-01,2016-12-25 19:57:14,what happened to the community ' hey everyone i just decided to start playing this game again after other things life other games took over i was really excited because i remembered the community around the launch of early access to be nice communicative and overall helpful the game felt fun i used to play a lot of mobas and this was a breath of fresh air in the four games today christmas of all days i have had three teammates tell me that i am absolute shit and to go kill myself what happened to this community it feels like a moba community not quite as bad as lol but it is starting to have a familiar feel to me more than it used to feel just like a bunch of people trying to compete yet still enjoying the competition even if someone is having a bad game it makes me hesitant to keep at it and i was excited about getting back into it ',"{'neg': 0.0, 'neu': 0.377, 'pos': 0.623, 'compound': 0.5106}","{'neg': 0.097, 'neu': 0.749, 'pos': 0.154, 'compound': 0.7207}"
0,everyone is healthy all else is superfluous,thekevmaester,nfl,3,-1,-1,2016-10-01,2016-10-20 17:09:25,week 7 positivity thread welcome to the weekly positivity thread the thread where the rules are made up and the points do not matter what is been going well for your team recently what are you excited or hopeful for in upcoming weeks this thread is a place for any and all positive thoughts regarding your team or the nfl in general all good vibes are welcome,"{'neg': 0.0, 'neu': 0.69, 'pos': 0.31, 'compound': 0.4019}","{'neg': 0.013, 'neu': 0.66, 'pos': 0.327, 'compound': 0.9781}"
0,smoke some weed i guess,still-improving,eldertrees,14,14,0,2016-09-01,2016-09-09 13:50:29,what is the plan for the weekend folks i am always interested in what other grownup humans do on their saturdays and sundays tonight is shabbos dinner with the family beloved wife is making cold spring rolls the perfect treat in this maddening heat tomorrow is farmers market for most of the day and probably old timey music playing with friends at night sunday is take the skating girl child to roller derby and all hands on deck clean the hell out of the house in the afternoon probably mow the goddamn lawn too maybe let my you gest kid try to train me up a little in fallout4 how do you spend your weekends,"{'neg': 0.0, 'neu': 1.0, 'pos': 0.0, 'compound': 0.0}","{'neg': 0.081, 'neu': 0.767, 'pos': 0.152, 'compound': 0.8156}"
0,what a great patrick kane review,iankilledyou,NHLHUT,11,-1,-1,2016-12-01,2016-12-06 11:16:51,patrick kane review buying a base card kaner biggest pros and cons for his play style,"{'neg': 0.0, 'neu': 0.549, 'pos': 0.451, 'compound': 0.6249}","{'neg': 0.0, 'neu': 0.862, 'pos': 0.138, 'compound': 0.34}"
0,fear shit we do not know about booooo,TheRightToBearArms,conspiracy,0,-1,-1,2016-10-01,2016-10-29 03:01:21,we have got very big problems ahead russia's new super nuke can wipe us out prepare for what is to come,"{'neg': 0.576, 'neu': 0.424, 'pos': 0.0, 'compound': -0.7783}","{'neg': 0.125, 'neu': 0.712, 'pos': 0.163, 'compound': 0.2315}"
0,yeah but when your handle is detachable you lose a lot of the stability of the pot sure they can try and make it safe as they want but that is not going to change the nature of what they are doing,Themeparkmaker,Showerthoughts,12,-1,-1,2016-10-01,2016-10-30 19:36:09,but that could happen just the same with a standard pot because they are held to the same safety standards,"{'neg': 0.075, 'neu': 0.717, 'pos': 0.208, 'compound': 0.6486}","{'neg': 0.0, 'neu': 0.837, 'pos': 0.163, 'compound': 0.5719}"
0,geoff chuckling like a child is so god damn awesome,bat_man_slayer,CFB,1,-1,-1,2016-12-01,2016-12-02 17:10:09,i am a fan of achievement hunters and they released a fucking 2 hours and 45 minutes video of them playing uno and i am watching it for the second time right now what is my life also prt in morgantown had what is probably it is first accident due to two cars colliding ever in 40 years of service,"{'neg': 0.149, 'neu': 0.25, 'pos': 0.601, 'compound': 0.8413}","{'neg': 0.075, 'neu': 0.859, 'pos': 0.066, 'compound': -0.128}"
0,more like they hate other people's freedoms when they down align with their beliefs which is pretty much every religious freedom legislation,Mol-lurker,politics,5,-1,-1,2016-11-01,2016-11-01 15:44:32,conservatives hate our freedoms more than the terrorists do and conservatives are100x more effective at stamping out our freedom and propagating fear than the terrorists could ever dream of,"{'neg': 0.119, 'neu': 0.51, 'pos': 0.372, 'compound': 0.8141}","{'neg': 0.319, 'neu': 0.436, 'pos': 0.245, 'compound': -0.6778}"
0,but i wanted to upgrade to a 4k tv with my 500 tax refund trump was going to give me to distract me from him shoveling our nation's resources into corporate america's pockets ,Mol-lurker,politics,0,-1,-1,2016-12-01,2016-12-03 01:29:46,let the trade wars begin american's will love paying more for most retail goods,"{'neg': 0.172, 'neu': 0.828, 'pos': 0.0, 'compound': -0.7684}","{'neg': 0.177, 'neu': 0.589, 'pos': 0.235, 'compound': 0.2924}"
0,same,Glory_Fades,fantasyfootball,0,-1,-1,2016-11-01,2016-11-01 15:48:15,wow man you are so epic and random i am 14 and this is funny,"{'neg': 0.0, 'neu': 1.0, 'pos': 0.0, 'compound': 0.0}","{'neg': 0.0, 'neu': 0.632, 'pos': 0.368, 'compound': 0.7901}"
0,there is not one,PunTC,politics,1,-1,-1,2016-12-01,2016-12-02 18:43:59,you missed the point,"{'neg': 0.0, 'neu': 1.0, 'pos': 0.0, 'compound': 0.0}","{'neg': 0.423, 'neu': 0.577, 'pos': 0.0, 'compound': -0.296}"
0,username checks out,Umikaloo,AskReddit,0,-1,-1,2016-10-01,2016-10-26 16:54:38,she does not watch porn,"{'neg': 0.0, 'neu': 1.0, 'pos': 0.0, 'compound': 0.0}","{'neg': 0.0, 'neu': 1.0, 'pos': 0.0, 'compound': 0.0}"
0,stop turning up so much smh,chainless,trap,3,-1,-1,2016-11-01,2016-11-19 07:53:39,i just want you to know i appreciate you,"{'neg': 0.544, 'neu': 0.456, 'pos': 0.0, 'compound': -0.5829}","{'neg': 0.0, 'neu': 0.636, 'pos': 0.364, 'compound': 0.4588}"
0,as if the weebs who like yasuo have any money they have probably spent it all on naruto body pillows and onaholes,RTSUbiytsa,leagueoflegends,-2,-1,-1,2016-10-01,2016-10-21 06:32:05,that is your own hangup luckily riot caters to anyone with money and the time to play their game,"{'neg': 0.0, 'neu': 0.889, 'pos': 0.111, 'compound': 0.3612}","{'neg': 0.148, 'neu': 0.617, 'pos': 0.235, 'compound': 0.2732}"
0,i have been a horny virgin teen before and never did i wish to be locked in a cupboard of ikea with them overnight so not so much bud,charizard_72,nottheonion,1,-1,-1,2016-12-01,2016-12-22 04:51:04,yeah how terrible to be in a small dark place with an attractive member of the opposite sex phew never sign me up for that one,"{'neg': 0.077, 'neu': 0.923, 'pos': 0.0, 'compound': -0.3089}","{'neg': 0.099, 'neu': 0.737, 'pos': 0.163, 'compound': 0.25}"
0,if your daughter is an infant my wife swears by cluster feeding in the hours before she goes to bed,abcedarian,AskParents,3,-1,-1,2016-11-01,2016-11-09 12:49:22,daughter waking up every hour my daughter wake up every hour after 230 she eats quick then goes back to sleep how can i fix this and what is causing it,"{'neg': 0.0, 'neu': 0.941, 'pos': 0.059, 'compound': 0.0516}","{'neg': 0.0, 'neu': 1.0, 'pos': 0.0, 'compound': 0.0}"
0,feeeeeeemales,SmarchHare,funny,1,-1,-1,2016-11-01,2016-11-24 21:06:45,omg feminists are the most opressed pls haaaelp,"{'neg': 0.0, 'neu': 1.0, 'pos': 0.0, 'compound': 0.0}","{'neg': 0.0, 'neu': 0.816, 'pos': 0.184, 'compound': 0.1477}"
0,true but this book is the wrong shape and look at the back that is obviously one of those author description pages,Zephyronno,stevenuniverse,1,1,0,2016-09-01,2016-09-06 07:27:36,have you ever seen sears catalogs from the 80s those fuckers are basically phone book sized,"{'neg': 0.166, 'neu': 0.758, 'pos': 0.076, 'compound': -0.5023}","{'neg': 0.206, 'neu': 0.794, 'pos': 0.0, 'compound': -0.5994}"
0,if you enjoyed the 1st season and want to see everything mcu then yeah,TheRedRajy,marvelstudios,2,-1,-1,2016-11-01,2016-11-17 20:06:48,should i see agent carter s2 it is probably the only thing in the mcu i have not seen i saw the first season and liked it should i bother with this one,"{'neg': 0.0, 'neu': 0.618, 'pos': 0.382, 'compound': 0.7003}","{'neg': 0.069, 'neu': 0.839, 'pos': 0.091, 'compound': 0.1926}"
0,and of course that responding to trump's brand of hate with violence is escalation and actually detrimental unlike with the far worse nazis,JoelMahon,socialism,1,-1,-1,2016-12-01,2016-12-29 22:05:18,this incessant comparing of trump to hitler is pure liberalism and has got to stop it is an insult to the millions that suffered and died under actual fascism,"{'neg': 0.353, 'neu': 0.647, 'pos': 0.0, 'compound': -0.8979}","{'neg': 0.339, 'neu': 0.661, 'pos': 0.0, 'compound': -0.9062}"
